Symbol,Name,Last Sale,Net Change,% Change,Market Cap,Country,IPO Year,Volume,Sector,Industry
PRSTW,Presto Automation Inc. Warrant,$0.02,0.00,0.00%,1615839.00,United States,2021,10,Technology,EDP Services
PRT,PermRock Royalty Trust Trust Units,$4.35,0.11,2.594%,52920934.00,United States,2018,8738,Energy,Oil & Gas Production
PRTA,Prothena Corporation plc Ordinary Shares,$23.53,0.16,0.685%,1264042306.00,United States,,23397,Health Care,Biotechnology: Pharmaceutical Preparations
PRTC,PureTech Health plc American Depositary Shares,$28.225,0.135,0.481%,772987208.00,United States,,279,Health Care,Biotechnology: Pharmaceutical Preparations
PRTG,Portage Biotech Inc. Common Stock,$0.52,0.01,1.961%,10284677.00,Canada,,478,Energy,Oil & Gas Production
PRTH,Priority Technology Holdings Inc. Common Stock,$3.2187,0.0087,0.271%,243954733.00,United States,2016,381,Technology,EDP Services
PRTS,CarParts.com Inc. Common Stock,$1.5794,0.0094,0.599%,89390065.00,United States,2007,79762,Consumer Discretionary,Auto & Home Supply Stores
PRU,Prudential Financial Inc. Common Stock,$115.54,-0.17,-0.147%,41478860000.00,United States,2001,104452,Finance,Life Insurance
PRVA,Privia Health Group Inc. Common Stock,$18.565,-0.005,-0.027%,2201230255.00,United States,2021,24488,Technology,Retail: Computer Software & Peripheral Equipment
PRZO,ParaZero Technologies Ltd. Ordinary Shares,$0.649,-0.039,-5.669%,6537997.00,Israel,2023,261866,,
PSA,Public Storage Common Stock,$283.67,1.10,0.389%,49838380573.00,United States,,29445,Real Estate,Real Estate Investment Trusts
PSA^F,Public Storage Depositary Shares Each Representing 1/1000 of a 5.15% Cumulative Preferred Share of Beneficial Interest Series F par value $0.01 per share,$24.18,0.03,0.124%,,United States,,414,,
PSA^G,Public Storage Depositary Shares Each Representing 1/1000 of a 5.05% Cumulative Preferred Share of Beneficial Interest Series G,$24.22,0.04,0.165%,,United States,,1274,,
PSA^H,Public Storage Depositary Shares Each Representing 1/1000 of a  5.60% Cumulative Preferred  Share of Beneficial Interest Series H,$24.8299,0.0099,0.04%,,United States,,1257,,
PSA^I,Public Storage Depositary Shares Each Representing 1/1000 of a 4.875% Cumulative Preferred Share of Beneficial Interest Series I par value $0.01 per share,$22.51,-0.02,-0.089%,,United States,,14219,,
PSA^J,Public Storage Depositary Shares Each Representing 1/1000 of a 4.700% Cumulative Preferred Share of Beneficial Interest Series J par value $0.01 per share,$21.25,0.00,0.00%,,United States,,50,,
PSA^K,Public Storage Depositary Shares Each Representing 1/1000 of a 4.75% Cumulative Preferred Share of Beneficial Interest Series K,$21.5599,-0.0001,0.00%,,United States,,2435,,
PSA^L,Public Storage Depositary Shares Each Representing 1/1000 of a 4.625% Cumulative Preferred Share of Beneficial Interest Series L par value $0.01 per share,$21.4299,0.1099,0.515%,,United States,,1028,,
PSA^M,Public Storage Depositary Shares Each Representing 1/1000 of a 4.125% Cumulative Preferred Share of Beneficial Interest Series M,$19.13,-0.04,-0.209%,,United States,,758,,
PSA^N,Public Storage Depositary Shares Each Representing 1/1000 of a 3.875% Cumulative Preferred Share of Beneficial Interest Series N,$17.72,-0.04,-0.225%,,United States,,2415,,
PSA^O,Public Storage Depositary Shares Each Representing 1/1000 of a 3.900% Cumulative Preferred Share of Beneficial Interest Series O,$17.78,-0.08,-0.448%,,United States,,173,,
PSA^P,Public Storage Depositary Shares Each Representing 1/1000 of a 4.000% Cumulative Preferred Share of Bene cial Interest Series P,$18.72,0.09,0.483%,,United States,,2953,,
PSA^Q,Public Storage Depositary Shares Each Representing 1/1000 of a 3.950% Cumulative Preferred Share of Beneficial Interest Series Q par value $0.01 per share,$17.86,-0.0901,-0.502%,,United States,,1178,,
PSA^R,Public Storage Depositary Shares Each Representing 1/1000 of a 4.00% Cumulative Preferred Share of Bene cial Interest Series R,$18.6499,0.0899,0.484%,,United States,,4511,,
PSA^S,Public Storage Depositary Shares Each Representing 1/1000 of a 4.100% Cumulative Preferred Share of Beneficial Interest Series S,$18.99,0.04,0.211%,,United States,,1143,,
PSBD,Palmer Square Capital BDC Inc. Common Stock,$16.255,0.065,0.401%,0.00,,2024,2317,,
PSEC,Prospect Capital Corporation Common Stock,$5.445,-0.005,-0.092%,2254161992.00,United States,2004,202624,Finance,Finance/Investors Services
PSEC^A,Prospect Capital Corporation 5.35% Series A Fixed Rate Cumulative Perpetual Preferred Stock,$18.95,-0.06,-0.316%,,United States,,374,,
PSF,Cohen & Steers Select Preferred and Income Fund Inc. Common Stock,$19.95,0.09,0.453%,980315629.00,,2010,655,Finance,Investment Managers
PSFE,Paysafe Limited Common Shares,$16.30,0.27,1.684%,1006026921.00,,2021,47792,Consumer Discretionary,Business Services
PSHG,Performance Shipping Inc. Common Shares,$2.20,0.05,2.326%,27015287.00,Greece,,27365,Consumer Discretionary,Marine Transportation
PSMT,PriceSmart Inc. Common Stock,$83.055,0.115,0.139%,2534487443.00,United States,,3845,Consumer Discretionary,Department/Specialty Retail Stores
PSN,Parsons Corporation Common Stock,$84.565,0.285,0.338%,8949478348.00,United States,2019,127786,Technology,EDP Services
PSNL,Personalis Inc. Common Stock,$1.371,-0.019,-1.367%,69240832.00,United States,2019,28896,Health Care,Medical Specialities
PSNY,Polestar Automotive Holding UK PLC Class A ADS,$1.615,0.055,3.526%,3407556330.00,Sweden,,430699,Consumer Discretionary,Auto Manufacturing
PSNYW,Polestar Automotive Holding UK PLC Class C-1 ADS (ADW),$0.1738,-0.0011,-0.629%,366707920.00,Sweden,,9520,Consumer Discretionary,Auto Manufacturing
PSO,Pearson Plc Common Stock,$12.685,-0.095,-0.743%,8709394848.00,United Kingdom,,62945,Consumer Discretionary,Books
PSQH,PSQ Holdings Inc. Class A Common Stock,$4.89,0.09,1.875%,138324667.00,,2021,10664,Consumer Discretionary,Advertising
PSTG,Pure Storage Inc. Class A Common Stock,$53.46,-0.33,-0.613%,17369705066.00,United States,2015,363303,Technology,Electronic Components
PSTL,Postal Realty Trust Inc. Class A Common Stock,$13.98,0.03,0.215%,314715355.00,United States,2019,16072,Real Estate,Real Estate Investment Trusts
PSTV,PLUS THERAPEUTICS Inc. Common Stock ,$1.88,0.00,0.00%,8039034.00,United States,,633,Health Care,Medical/Dental Instruments
PSTX,Poseida Therapeutics Inc. Common Stock,$2.945,-0.045,-1.505%,284160479.00,United States,2020,44277,Health Care,Biotechnology: Biological Products (No Diagnostic Substances)
PSX,Phillips 66 Common Stock,$169.28,-1.47,-0.861%,72422119341.00,United States,,285329,Energy,Integrated oil Companies
PT,Pintec Technology Holdings Limited American Depositary Shares,$1.10,0.00,0.00%,9545757.00,China,2018,58,Technology,Computer Software: Programming Data Processing
PTA,Cohen & Steers Tax-Advantaged Preferred Securities and Income Fund Common Shares of Beneficial Interest,$19.0401,0.0001,0.001%,1052412149.00,United States,2020,21677,Finance,Trusts Except Educational Religious and Charitable
PTC,PTC Inc. Common Stock,$185.74,0.46,0.248%,22205663705.00,United States,,84316,Technology,Computer Software: Prepackaged Software
PTCT,PTC Therapeutics Inc. Common Stock,$27.095,0.075,0.278%,2075694573.00,United States,2013,30937,Health Care,Biotechnology: Pharmaceutical Preparations
PTEN,Patterson-UTI Energy Inc. Common Stock,$12.215,-0.305,-2.436%,4986068163.00,United States,1993,542854,Energy,Oil & Gas Production
PTGX,Protagonist Therapeutics Inc. Common Stock,$27.8281,-0.1719,-0.614%,1621682472.00,United States,2016,30425,Health Care,Biotechnology: Pharmaceutical Preparations
PTIX,Protagenic Therapeutics Inc. Common Stock,$1.65,0.04,2.484%,7317968.00,United States,,739,Health Care,Biotechnology: Pharmaceutical Preparations
PTLO,Portillo's Inc. Class A Common Stock,$13.295,0.235,1.799%,739862283.00,United States,2021,82202,Consumer Discretionary,Restaurants
PTMN,Portman Ridge Finance Corporation Common Stock,$19.22,0.06,0.313%,179490583.00,United States,2006,2886,Finance,Finance: Consumer Services
PTN,Palatin Technologies Inc. Common Stock,$2.42,0.66,37.50%,39050669.00,United States,1999,7719804,Health Care,Biotechnology: Pharmaceutical Preparations
PTON,Peloton Interactive Inc. Class A Common Stock,$3.73,0.11,3.039%,1368435372.00,United States,2019,2008300,Consumer Discretionary,Recreational Games/Products/Toys
PTPI,Petros Pharmaceuticals Inc. Common Stock,$0.9057,-0.0194,-2.097%,6227425.00,United States,,120613,Health Care,Biotechnology: Pharmaceutical Preparations
PTSI,P.A.M. Transportation Services Inc. Common Stock,$15.11,-0.13,-0.853%,332945254.00,United States,1986,1451,Industrials,Trucking Freight/Courier Services
PTVE,Pactiv Evergreen Inc. Common stock,$14.97,0.08,0.537%,2672999577.00,United States,2020,27655,Consumer Discretionary,Containers/Packaging
PTWO,Pono Capital Two Inc. Class A Common Stock,$12.80,0.00,0.00%,0.00,United States,2022,1,Finance,Blank Checks
PTY,Pimco Corporate & Income Opportunity Fund,$15.0301,-0.0199,-0.132%,0.00,United States,2002,209898,Finance,Investment Managers
PUBM,PubMatic Inc. Class A Common Stock,$23.84,0.15,0.633%,1192203927.00,United States,2020,45148,Technology,Computer Software: Prepackaged Software
PUCK,Goal Acquisitions Corp. Common Stock,$11.00,0.00,0.00%,0.00,United States,2021,2,Finance,Blank Checks
PUCKW,Goal Acquisitions Corp. Warrant,$0.0087,-0.0003,-3.333%,0.00,United States,2021,19004,Finance,Blank Checks
PUK,Prudential Public Limited Company Common Stock,$18.25,-0.01,-0.055%,25125876899.00,United Kingdom,,96996,Finance,Life Insurance
PULM,Pulmatrix Inc. Common Stock,$2.03,0.021,1.045%,7414139.00,United States,2014,9917,Health Care,Biotechnology: Pharmaceutical Preparations
PUMP,ProPetro Holding Corp. Common Stock,$8.445,-0.155,-1.802%,908403940.00,United States,2017,56318,Energy,Oilfield Services/Equipment
PVBC,Provident Bancorp Inc. (MD) Common Stock,$8.83,-0.17,-1.889%,155930259.00,United States,2015,11580,Finance,Major Banks
PVH,PVH Corp. Common Stock,$109.845,1.185,1.091%,6336838099.00,United States,,283483,Consumer Discretionary,Apparel
PVL,Permianville Royalty Trust Trust Units ,$1.3717,-0.0083,-0.601%,45266100.00,United States,2011,6107,Energy,Oil & Gas Production
PW,Power REIT (MD) Common Stock,$0.5111,-0.0502,-8.944%,1732456.00,United States,1998,4853,Real Estate,Real Estate Investment Trusts
PW^A,Power REIT 7.75% Series A Cumulative Perpetual Preferred Stock,$3.432,-0.3181,-8.482%,,United States,,952,,
PWFL,PowerFleet Inc. Common Stock,$4.51,-0.23,-4.852%,167827491.00,United States,,205292,Telecommunications,Telecommunications Equipment
PWM,Prestige Wealth Inc. Class A Ordinary Shares,$1.3798,0.0498,3.744%,12625170.00,Hong Kong,2023,6791,,
PWOD,Penns Woods Bancorp Inc. Common Stock,$19.055,0.145,0.767%,143177326.00,United States,,1384,Finance,Major Banks
PWP,Perella Weinberg Partners Class A Common Stock,$15.08,-0.16,-1.05%,1301770233.00,United States,2020,37534,Finance,Finance: Consumer Services
PWR,Quanta Services Inc. Common Stock,$261.695,-1.505,-0.572%,38141778274.00,United States,,42547,Industrials,Engineering & Construction
PWSC,PowerSchool Holdings Inc. Class A Common Stock,$21.1301,0.0701,0.333%,4280817850.00,United States,2021,38927,Technology,Computer Software: Prepackaged Software
PWUP,PowerUp Acquisition Corp. Class A Ordinary Shares,$11.07,0.00,0.00%,0.00,United States,2022,4,Finance,Blank Checks
PWUPU,PowerUp Acquisition Corp. Unit,$11.0076,0.00,0.00%,0.00,United States,2022,60,Finance,Blank Checks
PX,P10 Inc. Class A Common Stock,$8.435,0.035,0.417%,977423634.00,United States,2021,15550,Finance,Investment Managers
PXD,Pioneer Natural Resources Company Common Stock,$270.58,-2.20,-0.807%,63213744080.00,United States,,329831,Energy,Oil & Gas Production
PXDT,Pixie Dust Technologies Inc. American Depositary Shares ,$2.50,0.01,0.402%,36755668.00,Japan,2023,4930,,
PXLW,Pixelworks Inc.  Common Stock,$2.25,0.01,0.446%,130042964.00,United States,2000,41253,Technology,Semiconductors
PXMD,PaxMedica Inc. Common Stock,$0.48,-0.01,-2.041%,3555872.00,United States,2022,11783,Health Care, Medicinal Chemicals and Botanical Products 
PXS,Pyxis Tankers Inc. Common Stock,$4.70,-0.02,-0.424%,50525000.00,Greece,,1048,Consumer Discretionary,Marine Transportation
PXSAP,Pyxis Tankers Inc. 7.75% Series A Cumulative Convertible Preferred Shares,$24.68,0.00,0.00%,312308914.00,Greece,,37,Consumer Discretionary,Marine Transportation
PXSAW,Pyxis Tankers Inc. Warrant,$1.20,-0.1101,-8.404%,15185198.00,Greece,,7499,Consumer Discretionary,Marine Transportation
PYCR,Paycor HCM Inc. Common Stock,$18.10,0.03,0.166%,3222343977.00,United States,2021,41929,Technology,Computer Software: Prepackaged Software
PYN,PIMCO New York Municipal Income Fund III Common Shares of Beneficial Interest,$5.74,0.00,0.00%,0.00,United States,2002,3834,Finance,Investment Managers
PYPD,PolyPid Ltd. Ordinary Shares,$4.77,-0.055,-1.14%,7887476.00,Israel,2020,1716,Health Care,Medical/Dental Instruments
PYPL,PayPal Holdings Inc. Common Stock,$66.09,0.94,1.443%,70831419792.00,United States,,1344155,Consumer Discretionary,Business Services
PYT,PPlus Tr GSC-2 Tr Ctf Fltg Rate,$23.10,0.00,0.00%,0.00,United States,,90,Finance,Finance: Consumer Services
PYXS,Pyxis Oncology Inc. Common Stock,$5.23,-0.23,-4.212%,304037551.00,United States,2021,164548,Health Care,Biotechnology: Pharmaceutical Preparations
PZC,PIMCO California Municipal Income Fund III Common Shares of Beneficial Interest,$7.52,-0.01,-0.133%,0.00,United States,2002,4054,Finance,Investment Managers
PZG,Paramount Gold Nevada Corp. Common Stock,$0.465,0.005,1.087%,28044305.00,United States,2015,23617,Basic Materials,Precious Metals
PZZA,Papa John's International Inc. Common Stock,$63.855,0.115,0.18%,2092341446.00,United States,1993,117581,Consumer Discretionary,Restaurants
QBTS,D-Wave Quantum Inc. Common Shares,$1.84,-0.04,-2.128%,297495108.00,,2022,1461424,Technology,Retail: Computer Software & Peripheral Equipment
QCOM,QUALCOMM Incorporated Common Stock,$172.71,1.18,0.688%,192744360000.00,United States,1991,937848,Technology,Computer peripheral equipment
QCRH,QCR Holdings Inc. Common Stock,$58.12,0.65,1.131%,976002186.00,United States,,2988,Finance,Major Banks
QD,Qudian Inc. American Depositary Shares each representing one Class A Ordinary Share,$2.455,0.035,1.446%,570164730.00,China,2017,250398,Finance,Finance: Consumer Services
QDEL,QuidelOrtho Corporation Common Stock,$42.79,0.09,0.211%,2860489677.00,United States,,51833,Health Care,Medical Specialities
QDRO,Quadro Acquisition One Corp. Class A Ordinary Shares,$11.01,0.00,0.00%,0.00,United States,2021,10000,Finance,Blank Checks
QDROW,Quadro Acquisition One Corp.  Warrant,$0.0457,0.00,0.00%,0.00,United States,2021,627,Finance,Blank Checks
QETAU,Quetta Acquisition Corporation Unit,$10.28,0.00,0.00%,0.00,United States,2023,2,,
QFIN,Qifu Technology Inc. American Depositary Shares,$19.61,0.33,1.712%,3164976188.00,China,2018,66056,Finance,Finance: Consumer Services
QGEN,Qiagen N.V. Common Shares,$41.295,0.125,0.304%,9423632768.00,Netherlands,,76376,Health Care,Biotechnology: Biological Products (No Diagnostic Substances)
QH,Quhuo Limited American Depository Shares,$0.57,-0.0098,-1.69%,3515544.00,China,2020,22474,Consumer Discretionary,Business Services
QIPT,Quipt Home Medical Corp. Common Shares,$4.06,0.01,0.247%,170936032.00,United States,,20984,Health Care,Misc Health and Biotechnology Services
QLGN,Qualigen Therapeutics Inc. Common Stock,$0.3749,-0.0203,-5.137%,1942379.00,United States,2015,8314,Health Care,Biotechnology: Pharmaceutical Preparations
QLI,Qilian International Holding Group Ltd. Ordinary Shares,$0.78,-0.0001,-0.013%,27885000.00,China,2021,6093,Health Care,Biotechnology: Pharmaceutical Preparations
QLYS,Qualys Inc. Common Stock,$165.38,0.54,0.328%,6115299093.00,United States,2012,19233,Technology,EDP Services
QMCO,Quantum Corporation Common Stock,$0.56,0.0006,0.107%,53222740.00,United States,,22232,Technology,Electronic Components
QNCX,Quince Therapeutics Inc. Common Stock,$1.04,0.015,1.463%,44943842.00,United States,2019,12342,Health Care,Biotechnology: Biological Products (No Diagnostic Substances)
QNRX,Quoin Pharmaceuticals Ltd. American Depositary Shares,$0.801,-0.0091,-1.123%,2952462.00,Israel,2016,11692,Health Care,Medical/Dental Instruments
QNST,QuinStreet Inc. Common Stock,$17.275,0.175,1.023%,948233474.00,United States,2010,13061,Consumer Discretionary,Advertising
QOMOR,Qomolangma Acquisition Corp. Right,$0.1232,0.00,0.00%,0.00,United States,2022,2,Finance,Blank Checks
QOMOU,Qomolangma Acquisition Corp. Unit,$11.36,0.62,5.773%,0.00,United States,2022,100,Finance,Blank Checks
QOMOW,Qomolangma Acquisition Corp. Warrant,$0.02,0.00,0.00%,0.00,United States,2022,502,Finance,Blank Checks
QQQX,Nuveen NASDAQ 100 Dynamic Overwrite Fund Shares of Beneficial Interest,$23.8301,0.0001,0.00%,0.00,United States,,16687,Finance,Finance Companies
QRHC,Quest Resource Holding Corporation Common Stock,$8.91,0.00,0.00%,179727174.00,United States,,376,Utilities,Environmental Services
QRTEA,Qurate Retail Inc. Series A Common Stock ,$1.035,0.015,1.471%,405459284.00,United States,,295828,Consumer Discretionary,Catalog/Specialty Distribution
QRTEB,Qurate Retail Inc. Series B Common Stock ,$4.24,0.00,0.00%,1661011944.00,United States,,34,Consumer Discretionary,Catalog/Specialty Distribution
QRTEP,Qurate Retail Inc. 8.0% Fixed Rate Cumulative Redeemable Preferred Stock,$49.2473,0.8773,1.814%,19292536205.00,United States,,8615,Consumer Discretionary,Catalog/Specialty Distribution
QRVO,Qorvo Inc. Common Stock,$114.495,-0.595,-0.517%,11054315699.00,United States,,88491,Technology,Semiconductors
QS,QuantumScape Corporation Class A Common Stock,$6.09,0.11,1.839%,3019479380.00,United States,2020,1015510,Consumer Discretionary,Auto Parts:O.E.M.
QSG,QuantaSing Group Limited American Depositary Shares,$3.87,0.03,0.781%,213647808.00,China,2023,73724,Real Estate,Other Consumer Services
QSI,Quantum-Si Incorporated Class A Common Stock,$1.875,0.055,3.022%,265818594.00,United States,2020,179965,Health Care,Biotechnology: Pharmaceutical Preparations
QSIAW,Quantum-Si Incorporated Warrant,$0.2625,-0.0001,-0.038%,37214603.00,United States,2020,1916,Health Care,Biotechnology: Pharmaceutical Preparations
QSR,Restaurant Brands International Inc. Common Shares,$74.34,-0.21,-0.282%,23215150112.00,Canada,2014,97036,,
QTI,QT Imaging Holdings Inc. Common Stock,$1.04,0.00,0.00%,22294705.00,United States,,22544,Health Care,Biotechnology: Electromedical & Electrotherapeutic Apparatus
QTRX,Quanterix Corporation Common Stock,$21.275,-0.205,-0.954%,809803473.00,United States,2017,23404,Industrials,Biotechnology: Laboratory Analytical Instruments
QTTB,Q32 Bio Inc. Common Stock,$20.50,0.28,1.385%,66207641.00,United States,2018,2090,Health Care,Biotechnology: Pharmaceutical Preparations
QTWO,Q2 Holdings Inc. Common Stock,$53.25,0.79,1.506%,3145701736.00,United States,2014,36847,Technology,EDP Services
QUAD,Quad Graphics Inc Class A Common Stock,$5.16,0.02,0.389%,269775806.00,United States,,20804,Consumer Discretionary,Publishing
QUBT,Quantum Computing Inc. Common Stock,$0.9085,-0.0439,-4.609%,82998416.00,United States,,385732,Technology,Computer Manufacturing
QUIK,QuickLogic Corporation Common Stock,$13.8585,-0.4215,-2.952%,199247660.00,United States,1999,88075,Technology,Semiconductors
QURE,uniQure N.V. Ordinary Shares,$5.07,-0.08,-1.553%,242540054.00,Netherlands,2014,89946,Health Care,Biotechnology: Pharmaceutical Preparations
QVCC,QVC Inc. 6.250% Senior Secured Notes due 2068,$13.75,0.08,0.585%,14.00,United States,2019,121,Consumer Discretionary,Catalog/Specialty Distribution
QVCD,QVC Inc. 6.375% Senior Secured Notes due 2067,$13.85,0.00,0.00%,14.00,United States,2018,220,Consumer Discretionary,Catalog/Specialty Distribution
R,Ryder System Inc. Common Stock,$119.31,0.71,0.599%,5239319446.00,United States,,4672,Consumer Discretionary,Rental/Leasing Companies
RA,Brookfield Real Assets Income Fund Inc. Common Stock,$12.9208,0.0258,0.20%,0.00,United States,2016,56449,Finance,Investment Managers
RACE,Ferrari N.V. Common Shares,$423.57,4.71,1.124%,76419690381.00,Italy,2015,24070,Consumer Discretionary,Auto Manufacturing
RAIL,FreightCar America Inc. Common Stock,$3.93,-0.04,-1.008%,72097768.00,United States,2005,2216,Industrials,Railroads
RAMP,LiveRamp Holdings Inc. Common Stock,$36.10,-0.43,-1.177%,2389232689.00,United States,2018,62532,Technology,EDP Services
RAND,Rand Capital Corporation Common Stock,$13.75,0.00,0.00%,35489039.00,United States,,505,Finance,Finance/Investors Services
RANI,Rani Therapeutics Holdings Inc. Class A Common Stock,$3.656,-0.044,-1.189%,183375060.00,United States,2021,13037,Health Care, Medicinal Chemicals and Botanical Products 
RAPT,RAPT Therapeutics Inc. Common Stock,$7.87,-0.03,-0.38%,273857915.00,United States,2019,92274,Health Care,Biotechnology: Pharmaceutical Preparations
RARE,Ultragenyx Pharmaceutical Inc. Common Stock,$49.67,-0.57,-1.135%,4089613573.00,United States,2014,33818,Health Care,Biotechnology: Pharmaceutical Preparations
RAVE,Rave Restaurant Group Inc. Common Stock,$2.209,0.029,1.33%,32221724.00,United States,,4914,Consumer Discretionary,Restaurants
RAYA,Erayak Power Solution Group Inc. Class A Ordinary Shares,$0.662,-0.045,-6.365%,8241900.00,China,2022,92957,Consumer Discretionary,Metal Fabrications
RBA,RB Global Inc. Common Stock,$74.26,-0.43,-0.576%,13590825340.00,Canada,,22840,,
RBB,RBB Bancorp Common Stock,$17.815,0.355,2.033%,331747029.00,United States,2017,1139,Finance,Major Banks
RBBN,Ribbon Communications Inc. Common Stock,$2.99,0.00,0.00%,515660558.00,United States,,11024,Technology,EDP Services
RBC,RBC Bearings Incorporated Common Stock,$267.06,1.03,0.387%,7793323822.00,United States,2022,4437,Industrials,Metal Fabrications
RBCAA,Republic Bancorp Inc. Class A Common Stock,$50.38,0.01,0.02%,977515482.00,United States,1998,1225,Finance,Major Banks
RBCP,RBC Bearings Incorporated 5.00% Series A Mandatory Convertible Preferred Stock,$119.65,0.00,0.00%,3491616848.00,United States,2022,7,Industrials,Metal Fabrications
RBKB,Rhinebeck Bancorp Inc. Common Stock,$8.00,0.00,0.00%,88580856.00,United States,2019,51,Finance,Banks
RBLX,Roblox Corporation Class A Common Stock,$38.37,0.55,1.454%,24235958693.00,United States,2021,815903,Technology,EDP Services
RBOT,Vicarious Surgical Inc. Class A Common Stock,$0.278,0.004,1.46%,48858965.00,Hong Kong,2020,413202,Health Care,Medical Specialities
RBT,Rubicon Technologies Inc. Class A Common Stock,$0.3771,-0.0102,-2.634%,20158893.00,,2022,88158,Technology,Semiconductors
RC,Ready Capital Corproation Common Stock,$8.7607,-0.0393,-0.447%,1511698418.00,United States,2013,121667,Real Estate,Real Estate Investment Trusts
RC^E,Ready Capital Corporation 6.50% Series E Cumulative Redeemable Preferred Stock,$18.66,0.00,0.00%,,United States,,1,,
RCAT,Red Cat Holdings Inc. Common Stock,$0.8075,0.0265,3.393%,59982327.00,United States,,34387,Industrials,Wholesale Distributors
RCB,Ready Capital Corporation 6.20% Senior Notes due 2026,$24.45,0.01,0.041%,4218958112.00,United States,2019,1070,Real Estate,Real Estate Investment Trusts
RCC,Ready Capital Corporation 5.75% Senior Notes due 2026,$24.1726,-0.0274,-0.113%,4171091487.00,United States,2021,753,Real Estate,Real Estate Investment Trusts
RCEL,Avita Medical Inc. Common Stock,$15.3809,-0.0091,-0.059%,395391598.00,United States,,3449,Health Care,Medical/Dental Instruments
RCFA,RCF Acquisition Corp. Class A Ordinary Shares,$11.17,0.02,0.179%,0.00,,2021,111,Finance,Blank Checks
RCG,RENN Fund Inc Common Stock,$1.586,-0.0339,-2.093%,0.00,United States,,15941,Finance,Investment Managers
RCI,Rogers Communication Inc. Common Stock,$39.49,-0.13,-0.328%,20979637830.00,Canada,,53592,,
RCKT,Rocket Pharmaceuticals Inc. Common Stock,$24.59,-0.42,-1.679%,2225499458.00,United States,2015,98117,Health Care,Biotechnology: Pharmaceutical Preparations
RCKTW,Rocket Pharmaceuticals Inc. Warrant,$0.1811,0.00,0.00%,,United States,,3,Health Care,Biotechnology: Pharmaceutical Preparations
RCKY,Rocky Brands Inc. Common Stock,$27.70,0.92,3.435%,205466024.00,United States,1993,2357,Consumer Discretionary,Shoe Manufacturing
RCL,Royal Caribbean Cruises Ltd. Common Stock,$138.08,2.06,1.514%,35438252298.00,United States,1993,248591,Consumer Discretionary,Marine Transportation
RCM,R1 RCM Inc. Common Stock,$12.665,0.195,1.564%,5322849164.00,United States,,192453,Consumer Discretionary,Other Consumer Services
RCMT,RCM Technologies Inc. Common Stock,$19.98,-0.35,-1.722%,158629592.00,United States,,26666,Consumer Discretionary,Professional Services
RCON,Recon Technology Ltd. Class A Ordinary Shares,$0.1318,-0.0032,-2.37%,5341619.00,China,2009,74951,Energy,Oilfield Services/Equipment
RCRT,Recruiter.com Group Inc. Common Stock,$1.62,0.00,0.00%,2322923.00,United States,,80,Technology,EDP Services
RCRTW,Recruiter.com Group Inc. Warrant,$0.008,0.00,0.00%,11471.00,United States,,3000,Technology,EDP Services
RCS,PIMCO Strategic Income Fund Inc.,$6.12,0.01,0.164%,0.00,United States,1994,13959,Finance,Investment Managers
RCUS,Arcus Biosciences Inc. Common Stock,$17.18,-0.16,-0.923%,1561057762.00,United States,2018,23341,Health Care,Biotechnology: Pharmaceutical Preparations
RDCM,Radcom Ltd. Ordinary Shares,$10.97,0.1954,1.814%,167925820.00,Israel,1997,7810,Technology,Computer peripheral equipment
RDDT,Reddit Inc. Class A Common Stock,$46.67,-0.89,-1.871%,7420207510.00,,2024,864143,,
RDFN,Redfin Corporation Common Stock,$6.20,0.02,0.324%,739297461.00,United States,2017,619366,Finance,Real Estate
RDHL,Redhill Biopharma Ltd. American Depositary Shares,$0.522,-0.007,-1.323%,15504980.00,Israel,,85824,Health Care,Biotechnology: Pharmaceutical Preparations
RDI,Reading International Inc Class A Common Stock,$1.77,-0.02,-1.117%,39569722.00,United States,,1795,Consumer Discretionary,Movies/Entertainment
RDIB,Reading International Inc Class B Common Stock,$14.45,0.45,3.214%,323040949.00,United States,,303,Consumer Discretionary,Movies/Entertainment
