Symbol,Name,Last Sale,Net Change,% Change,Market Cap,Country,IPO Year,Volume,Sector,Industry
DD,DuPont de Nemours Inc. Common Stock,$75.985,0.455,0.602%,31730033921.00,United States,2017,142260,Industrials,Major Chemicals
DDC,DDC Enterprise Limited Class A Ordinary Shares,$1.3972,-0.0028,-0.20%,27836511.00,,2023,191,Basic Materials,Metal Mining
DDD,3D Systems Corporation Common Stock,$4.03,0.02,0.499%,537739217.00,United States,,143743,Technology,Computer Software: Prepackaged Software
DDI,DoubleDown Interactive Co. Ltd. American Depository Shares,$10.2112,0.6262,6.533%,506000087.00,South Korea,2021,43787,Technology,EDP Services
DDL,Dingdong (Cayman) Limited American Depositary Shares (each two representing three Ordinary Shares),$1.34,0.06,4.688%,316271120.00,Cayman Islands,2021,27953,Consumer Discretionary,Catalog/Specialty Distribution
DDOG,Datadog Inc. Class A Common Stock,$124.675,0.275,0.221%,41376404290.00,United States,2019,271153,Technology,EDP Services
DDS,Dillard's Inc. Common Stock,$428.48,2.03,0.476%,6954263821.00,United States,,14775,Consumer Discretionary,Department/Specialty Retail Stores
DDT,Dillard's Capital Trust I,$26.03,0.00,0.00%,422468930.00,United States,,2,Consumer Discretionary,Department/Specialty Retail Stores
DE,Deere & Company Common Stock,$411.275,-1.265,-0.307%,114481772818.00,United States,,231503,Industrials,Industrial Machinery/Components
DEA,Easterly Government Properties Inc. Common Stock,$11.46,0.13,1.147%,1172984885.00,United States,2015,97799,Real Estate,Real Estate Investment Trusts
DEC,Diversified Energy Company plc Ordinary Shares,$12.98,0.12,0.933%,617535558.00,,,34177,,
DECA,Denali Capital Acquisition Corp. Class A Ordinary Shares,$8.59,0.41,5.012%,0.00,United States,2022,21208,Finance,Blank Checks
DECAU,Denali Capital Acquisition Corp. Unit,$8.30,0.00,0.00%,0.00,United States,2022,11,Finance,Blank Checks
DECK,Deckers Outdoor Corporation Common Stock,$877.45,-2.44,-0.277%,22522579639.00,United States,1993,26786,Consumer Discretionary,Shoe Manufacturing
DEI,Douglas Emmett Inc. Common Stock,$13.43,0.31,2.363%,2247536286.00,United States,2006,165537,Real Estate,Real Estate Investment Trusts
DELL,Dell Technologies Inc. Class C Common Stock ,$127.145,-5.575,-4.201%,90754872144.00,United States,2018,3631438,Technology,Computer Manufacturing
DENN,Denny's Corporation Common Stock,$8.6194,0.1794,2.126%,450395706.00,United States,,94938,Consumer Discretionary,Restaurants
DEO,Diageo plc Common Stock,$143.88,-0.56,-0.388%,80353552491.00,United Kingdom,,81497,Consumer Staples,Beverages (Production/Distribution)
DERM,Journey Medical Corporation Common Stock,$3.63,-0.05,-1.359%,72354285.00,United States,2021,42059,Health Care,Biotechnology: Pharmaceutical Preparations
DESP,Despegar.com Corp. Ordinary Shares,$12.02,0.19,1.606%,794041200.00,Argentina,2017,174711,Consumer Discretionary,Transportation Services
DFH,Dream Finders Homes Inc. Class A Common Stock,$42.72,-0.20,-0.466%,3984337276.00,United States,2022,32355,Consumer Discretionary,Homebuilding
DFIN,Donnelley Financial Solutions Inc. Common Stock ,$61.19,0.21,0.344%,1780032030.00,United States,2016,3993,Consumer Discretionary,Other Consumer Services
DFLI,Dragonfly Energy Holdings Corp. Common Stock (NV),$0.4701,-0.0249,-5.03%,27994837.00,United States,2021,142852,Technology,Electronic Components
DFLIW,Dragonfly Energy Holdings Corp. Warrant,$0.0339,-0.0013,-3.693%,2018773.00,United States,2021,2500,Technology,Electronic Components
DFP,Flaherty & Crumrine Dynamic Preferred and Income Fund Inc. Common Stock,$18.7401,0.0001,0.001%,0.00,,2013,5705,Finance,Investment Managers
DFS,Discover Financial Services Common Stock,$126.64,0.78,0.62%,31730322432.00,United States,,75162,Finance,Finance: Consumer Services
DG,Dollar General Corporation Common Stock,$156.685,-2.865,-1.796%,34419200147.00,United States,2009,387891,Consumer Discretionary,Department/Specialty Retail Stores
DGHI,Digihost Technology Inc. Common Subordinate Voting Shares,$1.40,-0.05,-3.448%,41062209.00,Canada,,11036,Finance,Finance: Consumer Services
DGICA,Donegal Group Inc. Class A Common Stock,$13.72,-0.05,-0.363%,458157846.00,United States,,3054,Finance,Property-Casualty Insurers
DGICB,Donegal Group Inc. Class B Common Stock,$12.821,0.00,0.00%,428137153.00,United States,1986,56,Finance,Property-Casualty Insurers
DGII,Digi International Inc. Common Stock,$31.41,0.52,1.683%,1138820183.00,United States,1989,9695,Telecommunications,Computer Communications Equipment
DGLY,Digital Ally Inc. Common Stock,$2.525,0.09,3.696%,7071899.00,United States,,26376,Technology,Radio And Television Broadcasting And Communications Equipment
DGX,Quest Diagnostics Incorporated Common Stock,$130.825,0.195,0.149%,14483281607.00,United States,,58268,Health Care,Medical Specialities
DH,Definitive Healthcare Corp. Class A Common Stock,$7.97,0.05,0.631%,938252509.00,United States,2021,27060,Technology,Computer Software: Prepackaged Software
DHAC,Digital Health Acquisition Corp. Common Stock,$12.1501,0.0301,0.248%,43788547.00,United States,2021,1111,Health Care,Medical/Nursing Services
DHACU,Digital Health Acquisition Corp. Unit,$13.34,0.00,0.00%,48076906.00,United States,2021,6,Health Care,Medical/Nursing Services
DHACW,Digital Health Acquisition Corp. Warrant,$0.1501,0.00,0.00%,540955.00,United States,2021,66,Health Care,Medical/Nursing Services
DHAI,DIH Holdings US Inc. Class A Common Stock,$1.11,0.01,0.909%,12165924.00,United States,2024,16960,,
DHAIW,DIH Holding US Inc. Warrants,$0.029,0.002,7.407%,317848.00,United States,2024,370,Finance,Blank Checks
DHC,Diversified Healthcare Trust Common Shares of Beneficial Interest,$2.64,0.05,1.931%,634704478.00,United States,,67512,Real Estate,Real Estate Investment Trusts
DHCNI,Diversified Healthcare Trust 5.625% Senior Notes due 2042,$15.01,-0.09,-0.596%,3608679629.00,United States,,320,Real Estate,Real Estate Investment Trusts
DHCNL,Diversified Healthcare Trust 6.25% Senior Notes Due 2046,$15.74,0.00,0.00%,3784185034.00,United States,,1717,Real Estate,Real Estate Investment Trusts
DHF,BNY Mellon High Yield Strategies Fund Common Stock,$2.355,-0.005,-0.212%,0.00,United States,1998,197743,Finance,Finance Companies
DHI,D.R. Horton Inc. Common Stock,$156.465,-2.055,-1.296%,51917791028.00,United States,,309195,Consumer Discretionary,Homebuilding
DHIL,Diamond Hill Investment Group Inc. Class A Common Stock,$150.79,1.33,0.89%,428784182.00,United States,,444,Finance,Investment Managers
DHR,Danaher Corporation Common Stock,$244.75,0.47,0.192%,181041997194.00,United States,,273645,Industrials,Industrial Machinery/Components
DHT,DHT Holdings Inc.,$11.44,-0.20,-1.718%,1841834760.00,Jersey,2005,177268,Consumer Discretionary,Marine Transportation
DHX,DHI Group Inc. Common Stock,$2.40,0.01,0.418%,115277969.00,United States,2007,12455,Consumer Discretionary,Business Services
DHY,Credit Suisse High Yield Bond Fund Common Stock,$2.055,0.025,1.232%,0.00,United States,1998,274882,Finance,Finance/Investors Services
DIAX,Nuveen Dow 30SM Dynamic Overwrite Fund Common Shares of Beneficial Interest,$14.12,-0.03,-0.212%,0.00,,2014,21266,Finance,Finance Companies
DIBS,1stdibs.com Inc. Common Stock,$5.91,0.01,0.169%,234897743.00,United States,2021,33020,Consumer Discretionary,Catalog/Specialty Distribution
DIN,Dine Brands Global Inc. Common Stock,$43.97,0.75,1.735%,670671992.00,United States,,27595,Consumer Discretionary,Restaurants
DINO,HF Sinclair Corporation Common Stock,$62.99,-0.72,-1.13%,12507823390.00,United States,1960,115508,Energy,Natural Gas Distribution
DIOD,Diodes Incorporated Common Stock,$68.85,0.96,1.414%,3162955505.00,United States,,15272,Technology,Semiconductors
DIS,Walt Disney Company (The) Common Stock,$117.245,-1.135,-0.959%,215062765543.00,United States,,1448019,Consumer Discretionary,Services-Misc. Amusement & Recreation
DIST,Distoken Acquisition Corporation Ordinary Shares,$10.78,0.00,0.00%,0.00,China,2023,79,Finance,Blank Checks
DISTR,Distoken Acquisition Corporation Right,$0.09,-0.0137,-13.211%,0.00,China,2023,210,Finance,Blank Checks
DIT,AMCON Distributing Company Common Stock,$176.69,0.00,0.00%,111378662.00,United States,1999,12,Consumer Discretionary,Food Distributors
DJCO,Daily Journal Corp. (S.C.) Common Stock,$370.95,0.00,0.00%,510807795.00,United States,,328,Consumer Discretionary,Newspapers/Magazines
DJT,Trump Media & Technology Group Corp. Common Stock,$36.8868,-3.7032,-9.123%,5042447065.00,United States,2024,3216109,Technology,Computer Software: Programming Data Processing
DJTWW,Trump Media & Technology Group Corp. Warrants,$13.38,-0.42,-3.043%,1829053801.00,United States,2021,127477,Technology,Computer Software: Programming Data Processing
DK,Delek US Holdings Inc. Common Stock,$32.44,-0.95,-2.845%,2076785021.00,United States,2017,128322,Energy,Integrated oil Companies
DKL,Delek Logistics Partners L.P. Common Units representing Limited Partner Interests,$39.62,-0.11,-0.277%,1728098052.00,United States,2012,23226,Energy,Oil & Gas Production
DKNG,DraftKings Inc. Class A Common Stock,$46.14,-1.06,-2.246%,39986468721.00,United States,2019,2596355,Consumer Discretionary,Services-Misc. Amusement & Recreation
DKS,Dick's Sporting Goods Inc Common Stock,$207.82,-0.93,-0.446%,17134412980.00,United States,2002,250320,Consumer Discretionary,Other Specialty Stores
DLA,Delta Apparel Inc. Common Stock,$2.78,0.03,1.091%,19602197.00,United States,2000,6586,Consumer Staples,Apparel
DLB,Dolby Laboratories Common Stock,$82.58,0.07,0.085%,7892900029.00,United States,2005,17338,Technology,EDP Services
DLHC,DLH Holdings Corp.,$13.16,0.12,0.92%,187276117.00,United States,,1424,Consumer Discretionary,Professional Services
DLNG,Dynagas LNG Partners LP Common Units,$3.03,-0.01,-0.329%,111510808.00,Greece,,4242,Consumer Discretionary,Marine Transportation
DLNG^A,Dynagas LNG Partners LP 9.00% Series A Cumulative Redeemable Preferred Units,$25.35,-0.04,-0.158%,,Greece,,1298,,
DLNG^B,Dynagas LNG Partners LP 8.75% Series B Fixed to Floating Rate Cumulative Redeemable Perpetual Preferred Units liquidation preference $25.00 per Uni,$25.79,0.00,0.00%,,Greece,,363,,
DLO,DLocal Limited Class A Common Shares,$16.44,0.19,1.169%,4866102973.00,Uruguay,2021,87703,Consumer Discretionary,Business Services
DLPN,Dolphin Entertainment Inc. Common Stock,$1.15,0.00,0.00%,21451931.00,United States,,905,Consumer Discretionary,Other Consumer Services
DLR,Digital Realty Trust Inc. Common Stock,$143.20,0.60,0.421%,44720438222.00,United States,2004,107664,Real Estate,Real Estate Investment Trusts
DLR^J,Digital Realty Trust Inc. 5.250% Series J Cumulative Redeemable Preferred Stock,$21.89,0.05,0.229%,,United States,,138,,
DLR^K,Digital Realty Trust Inc. 5.850% Series K Cumulative Redeemable Preferred Stock par value $0.01 per share,$23.69,-0.01,-0.042%,,United States,,5155,,
DLR^L,Digital Realty Trust Inc. 5.200% Series L Cumulative Redeemable Preferred Stock,$21.66,-0.02,-0.092%,,United States,,6219,,
DLTH,Duluth Holdings Inc. Class B Common Stock,$4.85,-0.03,-0.615%,166896823.00,United States,2015,7942,Consumer Discretionary,Clothing/Shoe/Accessory Stores
DLTR,Dollar Tree Inc. Common Stock,$129.7899,-0.9201,-0.704%,28291994108.00,United States,1995,293416,Consumer Discretionary,Department/Specialty Retail Stores
DLX,Deluxe Corporation Common Stock,$19.70,-0.07,-0.354%,863846497.00,United States,,8302,Consumer Discretionary,Advertising
DLY,DoubleLine Yield Opportunities Fund Common Shares of Beneficial Interest,$15.89,-0.05,-0.314%,761858428.00,United States,2020,36259,Finance,Investment Managers
DM,Desktop Metal Inc. Class A Common Stock,$0.965,0.0333,3.574%,318099235.00,United States,2019,362440,Technology,Industrial Machinery/Components
DMA,Destra Multi-Alternative Fund Common Stock,$7.46,-0.02,-0.267%,0.00,,2022,608,Finance,Trusts Except Educational Religious and Charitable
DMAC,DiaMedica Therapeutics Inc. Common Stock,$2.8235,-0.1565,-5.252%,107174413.00,United States,2018,9508,Health Care,Biotechnology: Pharmaceutical Preparations
DMB,BNY Mellon Municipal Bond Infrastructure Fund Inc. Common Stock,$10.20,0.04,0.394%,0.00,,2013,20508,Finance,Trusts Except Educational Religious and Charitable
DMF,BNY Mellon Municipal Income Inc. Common Stock,$6.76,0.045,0.67%,421086173.00,United States,1988,4040,Finance,Finance/Investors Services
DMLP,Dorchester Minerals L.P. Common Units Representing Limited Partnership Interests,$34.57,-0.36,-1.031%,1368392711.00,United States,,13968,Energy,Oil & Gas Production
DMO,Western Asset Mortgage Opportunity Fund Inc. Common Stock,$11.7964,-0.0336,-0.284%,0.00,United States,2010,24345,Finance,Trusts Except Educational Religious and Charitable
DMRC,Digimarc Corporation Common Stock,$24.74,0.25,1.021%,505774565.00,United States,,13358,Technology,EDP Services
DMTK,DermTech Inc. Common Stock,$0.62,0.00,0.00%,21466535.00,United States,2017,14013,Health Care,Medical Specialities
DNA,Ginkgo Bioworks Holdings Inc. Class A Common Stock,$1.075,-0.005,-0.463%,2313825470.00,United States,2021,3460276,Health Care,Biotechnology: Biological Products (No Diagnostic Substances)
DNB,Dun & Bradstreet Holdings Inc. Common Stock,$9.515,0.025,0.263%,4175144302.00,United States,2020,257352,Finance,Finance: Consumer Services
DNLI,Denali Therapeutics Inc. Common Stock,$19.17,-0.22,-1.135%,2667701782.00,United States,2017,46938,Health Care,Biotechnology: Biological Products (No Diagnostic Substances)
DNMR,Danimer Scientific Inc. Common Stock,$1.11,0.06,5.714%,126807422.00,United States,2020,97669,Industrials,Major Chemicals
DNN,Denison Mines Corp Ordinary Shares (Canada),$2.0505,-0.0895,-4.182%,1826988059.00,Canada,,3312261,,
DNOW,DNOW Inc. Common Stock,$15.25,0.09,0.594%,1619032964.00,United States,2014,32634,Industrials,Metal Fabrications
DNP,DNP Select Income Fund Inc. Common Stock,$8.985,0.015,0.167%,0.00,United States,1987,55921,Finance,Investment Managers
DNTH,Dianthus Therapeutics Inc. Common Stock,$24.94,-0.15,-0.598%,731908194.00,United States,2018,13411,Health Care,Biotechnology: Pharmaceutical Preparations
DNUT,Krispy Kreme Inc. Common Stock,$14.604,-0.726,-4.736%,2463694800.00,United States,2021,1728753,Consumer Staples,Food Chains
DO,Diamond Offshore Drilling Inc. Common Stock,$14.35,-0.23,-1.578%,1470402985.00,United States,2022,151110,Energy,Oil & Gas Production
DOC,Healthpeak Properties Inc. Common Stock,$18.535,-0.095,-0.51%,10141851240.00,United States,,421167,Real Estate,Real Estate Investment Trusts
DOCN,DigitalOcean Holdings Inc. Common Stock,$37.41,0.09,0.241%,3396704360.00,United States,2021,47599,Technology,Retail: Computer Software & Peripheral Equipment
DOCS,Doximity Inc. Class A Common Stock,$26.11,0.30,1.162%,4870918413.00,United States,2021,1089401,Technology,Retail: Computer Software & Peripheral Equipment
DOCU,DocuSign Inc. Common Stock,$59.85,0.38,0.639%,12294095471.00,United States,2018,297644,Technology,Computer Software: Prepackaged Software
DOGZ,Dogness (International) Corporation Class A Common Stock,$9.37,1.32,16.398%,99525919.00,China,2017,70643,Consumer Discretionary,Miscellaneous manufacturing industries
DOLE,Dole plc Ordinary Shares,$11.80,0.10,0.855%,1120164312.00,Ireland,2021,27251,Consumer Staples,Farming/Seeds/Milling
DOMA,Doma Holdings Inc. Common Stock,$6.06,0.01,0.165%,84159898.00,United States,2021,4603,Finance,Real Estate
DOMH,Dominari Holdings Inc. Common Stock,$3.0725,-0.0675,-2.15%,18235032.00,United States,,18108,Health Care,Biotechnology: Pharmaceutical Preparations
DOMO,Domo Inc. Class B Common Stock,$8.82,-0.02,-0.226%,335435272.00,United States,2018,14334,Technology,Computer Software: Prepackaged Software
DOOO,BRP Inc. (Recreational Products) Common Subordinate Voting Shares,$72.20,-0.51,-0.701%,5411857062.00,Canada,,10348,,
DOOR,Masonite International Corporation Ordinary Shares (Canada),$130.92,0.17,0.13%,2871396616.00,Canada,,49238,Basic Materials,Forest Products
DORM,Dorman Products Inc. Common Stock,$97.25,0.88,0.913%,3023137035.00,United States,,19036,Consumer Discretionary,Auto Parts:O.E.M.
DOUG,Douglas Elliman Inc. Common Stock,$1.595,-0.005,-0.313%,145998982.00,United States,2021,41753,Real Estate,Building operators
DOV,Dover Corporation Common Stock,$176.75,0.91,0.518%,24726736423.00,United States,,111329,Industrials,Industrial Machinery/Components
DOW,Dow Inc. Common Stock ,$59.43,-0.26,-0.436%,41737298723.00,United States,2019,348713,Industrials,Major Chemicals
DOX,Amdocs Limited Ordinary Shares,$87.81,-0.02,-0.023%,10304311986.00,Guernsey,,51616,Technology,EDP Services
DOYU,DouYu International Holdings Limited ADS,$7.90,0.07,0.894%,252623554.00,China,2019,14683,Technology,Computer Software: Programming Data Processing
DPCS,DP Cap Acquisition Corp I Class A Ordinary Shares,$11.09,0.00,0.00%,0.00,United States,2021,62,Finance,Blank Checks
DPG,Duff & Phelps Utility and Infrastructure Fund Inc.,$9.36,0.00,0.00%,0.00,United States,2011,16269,Finance,Trusts Except Educational Religious and Charitable
DPRO,Draganfly Inc. Common Shares,$0.23,0.0093,4.214%,11189556.00,Canada,,230165,Industrials,Aerospace
DPSI,DecisionPoint Systems Inc. Common Stock,$8.9617,-0.1248,-1.373%,68828849.00,,2022,858,Technology,Retail: Computer Software & Peripheral Equipment
DPZ,Domino's Pizza Inc Common Stock,$500.80,7.60,1.541%,17434211678.00,United States,2004,91230,Consumer Discretionary,Food Distributors
DQ,DAQO New Energy Corp. American Depositary Shares each representing five ordinary shares,$26.34,-0.70,-2.589%,2059910876.00,China,2010,140966,Technology,Semiconductors
DRCT,Direct Digital Holdings Inc. Class A Common Stock,$11.58,-1.03,-8.168%,165251522.00,United States,2022,44011,Technology,Computer Software: Programming Data Processing
DRD,DRDGOLD Limited American Depositary Shares,$8.66,-0.21,-2.368%,748733823.00,South Africa,,127677,Basic Materials,Precious Metals
DRH,Diamondrock Hospitality Company Common Stock,$9.395,-0.045,-0.477%,1969447516.00,United States,2005,61979,Real Estate,Real Estate Investment Trusts
DRH^A,Diamondrock Hospitality Company 8.250% Series A Cumulative Redeemable Preferred Stock,$25.36,0.00,0.00%,,United States,,11,,
DRI,Darden Restaurants Inc. Common Stock,$158.60,2.25,1.439%,18930328994.00,United States,,108945,Consumer Discretionary,Restaurants
DRIO,DarioHealth Corp. Common Stock,$1.37,0.02,1.481%,40336269.00,Israel,,7143,Health Care,Medical/Dental Instruments
DRMA,Dermata Therapeutics Inc. Common Stock,$0.4161,0.0011,0.265%,2771576.00,United States,2021,10455,Health Care,Biotechnology: Pharmaceutical Preparations
DRMAW,Dermata Therapeutics Inc. Warrant,$0.014,0.0038,37.255%,93252.00,United States,2021,22181,Health Care,Biotechnology: Pharmaceutical Preparations
DRQ,Dril-Quip Inc. Common Stock,$23.11,-0.09,-0.388%,795305368.00,United States,1997,6769,Industrials,Metal Fabrications
DRRX,DURECT Corporation Common Stock,$0.93,-0.0017,-0.182%,28863462.00,United States,2000,10309,Health Care,Biotechnology: Pharmaceutical Preparations
DRS,Leonardo DRS Inc. Common Stock,$21.145,0.245,1.172%,5553309489.00,Israel,,333968,Industrials,Military/Government/Technical
DRTS,Alpha Tau Medical Ltd. Ordinary Shares,$2.90,0.0001,0.003%,202044775.00,Israel,,4309,Health Care,Biotechnology: Pharmaceutical Preparations
DRTSW,Alpha Tau Medical Ltd. Warrant,$0.2619,0.0083,3.273%,18246733.00,Israel,,204,Health Care,Biotechnology: Pharmaceutical Preparations
DRUG,Bright Minds Biosciences Inc. Common Stock,$1.26,0.09,7.692%,5624435.00,Canada,,3888,Health Care,Pharmaceuticals and Biotechnology
DRVN,Driven Brands Holdings Inc. Common Stock,$14.82,-0.08,-0.537%,2430059127.00,United States,2021,46232,Consumer Discretionary,Automotive Aftermarket
DSAQ,Direct Selling Acquisition Corp. Class A Common Stock,$11.12,0.06,0.542%,0.00,,2021,144,Finance,Blank Checks
DSGN,Design Therapeutics Inc. Common Stock,$3.785,0.025,0.665%,213830816.00,United States,2021,39499,Health Care,Biotechnology: Pharmaceutical Preparations
DSGR,Distribution Solutions Group Inc. Common Stock,$35.37,-0.18,-0.506%,1654726488.00,United States,,3775,Industrials,Industrial Machinery/Components
DSGX,Descartes Systems Group Inc. (The) Common Stock,$90.11,0.40,0.446%,7675881130.00,Canada,,9826,Technology,Computer Software: Prepackaged Software
DSL,DoubleLine Income Solutions Fund Common Shares of Beneficial Interests,$12.58,0.00,0.00%,1283120096.00,United States,2013,54299,Finance,Trusts Except Educational Religious and Charitable
DSM,BNY Mellon Strategic Municipal Bond Fund Inc. Common Stock,$5.775,0.055,0.962%,0.00,United States,1989,21076,Finance,Investment Managers
DSP,Viant Technology Inc. Class A Common Stock,$10.25,-0.75,-6.818%,643995108.00,United States,2021,165272,Technology,EDP Services
DSS,DSS Inc. Common Stock,$1.8804,0.0034,0.181%,13288358.00,United States,,3211,Consumer Discretionary,Containers/Packaging
DSU,Blackrock Debt Strategies Fund Inc. Common Stock,$10.85,0.04,0.37%,0.00,United States,1998,20452,Finance,Finance Companies
DSWL,Deswell Industries Inc. Common Shares,$2.24,0.00,0.00%,35694935.00,Macau,1995,4196,Industrials,Plastic Products
DSX,Diana Shipping inc. common stock,$2.925,-0.025,-0.847%,455881754.00,Greece,2005,61556,Consumer Discretionary,Marine Transportation
DSX^B,Diana Shipping Inc. Perpetual Preferred Shares Series B (Marshall Islands),$26.70,0.00,0.00%,,Greece,,1011,,
DT,Dynatrace Inc. Common Stock,$46.685,0.705,1.533%,13818724800.00,United States,2019,428972,Technology,EDP Services
DTB,DTE Energy Company 2020 Series G 4.375% Junior Subordinated Debentures due 2080,$20.46,0.00,0.00%,4224028073.00,United States,2020,313,Utilities,Electric Utilities: Central
DTC,Solo Brands Inc. Class A Common Stock,$1.94,0.03,1.571%,176881401.00,United States,2021,48612,Consumer Discretionary,Recreational Games/Products/Toys
DTCK,Davis Commodities Limited Ordinary Shares,$1.045,-0.015,-1.415%,25432688.00,Singapore,2023,2032,Industrials,Farming/Seeds/Milling
DTE,DTE Energy Company Common Stock,$109.52,0.42,0.385%,22610730917.00,United States,,84491,Utilities,Electric Utilities: Central
DTF,DTF Tax-Free Income 2028 Term Fund Inc. Common Stock,$10.70,0.005,0.047%,75216367.00,United States,1991,1911,Finance,Investment Managers
DTG,DTE Energy Company 2021 Series E 4.375% Junior Subordinated Debentures,$20.41,0.00,0.00%,4213705424.00,United States,2021,2308,Utilities,Electric Utilities: Central
DTI,Drilling Tools International Corporation Common Stock,$4.65,-0.03,-0.641%,138423841.00,United States,2021,13130,Industrials,Metal Fabrications
DTIL,Precision BioSciences Inc. Common Stock,$14.11,-0.16,-1.121%,97588132.00,United States,2019,11090,Health Care,Biotechnology: Biological Products (No Diagnostic Substances)
DTM,DT Midstream Inc. Common Stock ,$62.71,-0.04,-0.064%,6081587957.00,United States,2021,71697,Utilities,Oil & Gas Production
DTSS,Datasea Inc. Common Stock,$8.395,0.005,0.06%,21308911.00,China,,19820,Technology,Computer Software: Prepackaged Software
DTST,Data Storage Corporation Common Stock,$5.655,-0.185,-3.168%,39132317.00,United States,,24335,Technology,EDP Services
DTSTW,Data Storage Corporation Warrant,$0.6231,-0.1528,-19.693%,4311821.00,United States,,19394,Technology,EDP Services
DTW,DTE Energy Company 2017 Series E 5.25% Junior Subordinated Debentures due 2077,$24.78,0.00,0.00%,5115904968.00,United States,2017,1278,Utilities,Electric Utilities: Central
DUK,Duke Energy Corporation (Holding Company) Common Stock,$95.78,-0.13,-0.136%,73828320298.00,United States,,185717,Utilities,Power Generation
DUK^A,Duke Energy Corporation Depositary Shares each representing a 1/1000th interest in a share of 5.75% Series A Cumulative Redeemable Perpetual Preferred Stock,$25.12,-0.045,-0.179%,,United States,,1284,,
DUKB,Duke Energy Corporation 5.625% Junior Subordinated Debentures due 2078,$24.74,0.00,0.00%,19069875174.00,United States,2018,1070,Utilities,Power Generation
DUO,Fangdd Network Group Ltd. American Depositary Shares,$0.4483,0.0204,4.767%,1658467.00,China,2019,24129,Finance,Real Estate
DUOL,Duolingo Inc. Class A Common Stock,$215.43,0.42,0.195%,9236739626.00,United States,2021,29812,Technology,Computer Software: Prepackaged Software
DUOT,Duos Technologies Group Inc. Common Stock,$3.35,0.065,1.979%,24477321.00,United States,,20636,Technology,Computer Software: Prepackaged Software
DV,DoubleVerify Holdings Inc. Common Stock,$33.185,0.425,1.297%,5683060738.00,United States,2021,122139,Technology,Computer Software: Prepackaged Software
DVA,DaVita Inc. Common Stock,$133.59,-0.02,-0.015%,11715843000.00,United States,,31752,Health Care,Misc Health and Biotechnology Services
DVAX,Dynavax Technologies Corporation Common Stock,$12.045,-0.005,-0.041%,1573254929.00,United States,2004,70791,Health Care,Biotechnology: Pharmaceutical Preparations
DVN,Devon Energy Corporation Common Stock,$53.12,-0.15,-0.282%,33731200000.00,United States,1985,1047012,Energy,Oil & Gas Production
DWSN,Dawson Geophysical Company Common Stock,$1.675,-0.045,-2.616%,51610651.00,United States,,12034,Energy,Oil & Gas Production
DX,Dynex Capital Inc. Common Stock,$12.06,-0.07,-0.577%,706044909.00,United States,,88624,Real Estate,Real Estate Investment Trusts
DX^C,Dynex Capital Inc. 6.900% Series C Fixed-to-Floating Rate Cumulative Redeemable Preferred Stock,$24.38,0.0322,0.132%,,United States,,3342,,
DXC,DXC Technology Company Common Stock ,$20.85,0.39,1.906%,3812852969.00,United States,,123828,Technology,EDP Services
DXCM,DexCom Inc. Common Stock,$138.22,-0.71,-0.511%,53285941491.00,United States,2005,255426,Health Care,Medical/Dental Instruments
DXF,Dunxin Financial Holdings Limited American Depositary Shares,$0.28,0.0068,2.489%,608101.00,China,,15462,Finance,Finance: Consumer Services
DXLG,Destination XL Group Inc. Common Stock,$3.435,0.005,0.146%,199192428.00,United States,,10849,Consumer Discretionary,Clothing/Shoe/Accessory Stores
DXPE,DXP Enterprises Inc. Common Stock,$55.39,-0.34,-0.61%,896227759.00,United States,,6514,Industrials,Industrial Machinery/Components
