PSMT,PriceSmart Inc. Common Stock,$83.53,0.59,0.711%,2548982435.00,United States,,172684,Consumer Discretionary,Department/Specialty Retail Stores
PSNL,Personalis Inc. Common Stock,$1.41,0.02,1.439%,71210483.00,United States,2019,80931,Health Care,Medical Specialities
PSN,Parsons Corporation Common Stock,$83.69,-0.59,-0.70%,8856877467.00,United States,2019,866713,Technology,EDP Services
PSNY,Polestar Automotive Holding UK PLC Class A ADS,$1.68,0.12,7.692%,3544702560.00,Sweden,,3070264,Consumer Discretionary,Auto Manufacturing
PSNYW,Polestar Automotive Holding UK PLC Class C-1 ADS (ADW),$0.18,0.0051,2.916%,379789560.00,Sweden,,27154,Consumer Discretionary,Auto Manufacturing
PSO,Pearson Plc Common Stock,$12.79,0.01,0.078%,8781486803.00,United Kingdom,,509153,Consumer Discretionary,Books
PSQH,PSQ Holdings Inc. Class A Common Stock,$4.87,0.07,1.458%,137758922.00,,2021,42909,Consumer Discretionary,Advertising
PSTG,Pure Storage Inc. Class A Common Stock,$53.75,-0.04,-0.074%,17463929055.00,United States,2015,2064465,Technology,Electronic Components
PSTL,Postal Realty Trust Inc. Class A Common Stock,$14.03,0.08,0.573%,315840947.00,United States,2019,59553,Real Estate,Real Estate Investment Trusts
PSTV,PLUS THERAPEUTICS Inc. Common Stock ,$1.89,0.01,0.532%,8081795.00,United States,,4982,Health Care,Medical/Dental Instruments
PSTX,Poseida Therapeutics Inc. Common Stock,$2.97,-0.02,-0.669%,286572707.00,United States,2020,420305,Health Care,Biotechnology: Biological Products (No Diagnostic Substances)
PSX,Phillips 66 Common Stock,$168.55,-2.20,-1.288%,72109807508.00,United States,,2624346,Energy,Integrated oil Companies
PTA,Cohen & Steers Tax-Advantaged Preferred Securities and Income Fund Common Shares of Beneficial Interest,$19.07,0.03,0.158%,1054064825.00,United States,2020,129508,Finance,Trusts Except Educational Religious and Charitable
PTC,PTC Inc. Common Stock,$186.41,1.13,0.61%,22285763816.00,United States,,614728,Technology,Computer Software: Prepackaged Software
PTCT,PTC Therapeutics Inc. Common Stock,$26.88,-0.14,-0.518%,2059223846.00,United States,2013,477882,Health Care,Biotechnology: Pharmaceutical Preparations
PTEN,Patterson-UTI Energy Inc. Common Stock,$12.12,-0.40,-3.195%,4947289900.00,United States,1993,4537110,Energy,Oil & Gas Production
PTGX,Protagonist Therapeutics Inc. Common Stock,$28.09,0.09,0.321%,1636944694.00,United States,2016,313517,Health Care,Biotechnology: Pharmaceutical Preparations
PTIX,Protagenic Therapeutics Inc. Common Stock,$1.53,-0.08,-4.969%,6785752.00,United States,,1593,Health Care,Biotechnology: Pharmaceutical Preparations
PTIXW,Protagenic Therapeutics Inc. Warrant,$0.027,0.002,8.00%,119749.00,United States,,6000,Health Care,Biotechnology: Pharmaceutical Preparations
PTLO,Portillo's Inc. Class A Common Stock,$13.38,0.32,2.45%,744592504.00,United States,2021,741666,Consumer Discretionary,Restaurants
PTMN,Portman Ridge Finance Corporation Common Stock,$19.23,0.07,0.365%,179583970.00,United States,2006,26193,Finance,Finance/Investors Services
PTN,Palatin Technologies Inc. Common Stock,$2.02,0.26,14.773%,32596013.00,United States,1999,12681075,Health Care,Biotechnology: Pharmaceutical Preparations
PTON,Peloton Interactive Inc. Class A Common Stock,$3.74,0.12,3.315%,1372104100.00,United States,2019,7101384,Consumer Discretionary,Recreational Games/Products/Toys
PT,Pintec Technology Holdings Limited American Depositary Shares,$1.09,-0.01,-0.909%,9458977.00,China,2018,55965,Technology,Computer Software: Programming Data Processing
PTPI,Petros Pharmaceuticals Inc. Common Stock,$0.9313,0.0062,0.67%,6403446.00,United States,,395400,Health Care,Biotechnology: Pharmaceutical Preparations
PTSI,P.A.M. Transportation Services Inc. Common Stock,$15.43,0.19,1.247%,339996378.00,United States,1986,13736,Industrials,Trucking Freight/Courier Services
PTVE,Pactiv Evergreen Inc. Common stock,$15.05,0.16,1.075%,2687284144.00,United States,2020,520166,Consumer Discretionary,Containers/Packaging
PTWO,Pono Capital Two Inc. Class A Common Stock,$12.80,0.00,0.00%,0.00,United States,2022,1,Finance,Blank Checks
PTY,Pimco Corporate & Income Opportunity Fund,$15.05,0.00,0.00%,0.00,United States,2002,720473,Finance,Investment Managers
PUBM,PubMatic Inc. Class A Common Stock,$23.68,-0.01,-0.042%,1184202559.00,United States,2020,265117,Technology,Computer Software: Prepackaged Software
PUCK,Goal Acquisitions Corp. Common Stock,$11.00,0.00,0.00%,0.00,United States,2021,2,Finance,Blank Checks
PUCKW,Goal Acquisitions Corp. Warrant,$0.0075,-0.0015,-16.667%,0.00,United States,2021,29137,Finance,Blank Checks
PUK,Prudential Public Limited Company Common Stock,$18.33,0.07,0.383%,25236017729.00,United Kingdom,,974285,Finance,Life Insurance
PULM,Pulmatrix Inc. Common Stock,$1.89,-0.119,-5.923%,6902819.00,United States,2014,16562,Health Care,Biotechnology: Pharmaceutical Preparations
PUMP,ProPetro Holding Corp. Common Stock,$8.36,-0.24,-2.791%,899260739.00,United States,2017,615346,Energy,Oilfield Services/Equipment
PVBC,Provident Bancorp Inc. (MD) Common Stock,$8.95,-0.05,-0.556%,158049357.00,United States,2015,25928,Finance,Major Banks
PVH,PVH Corp. Common Stock,$109.33,0.67,0.617%,6307128312.00,United States,,1514766,Consumer Discretionary,Apparel
PVL,Permianville Royalty Trust Trust Units ,$1.40,0.02,1.449%,46200000.00,United States,2011,76095,Energy,Oil & Gas Production
PW^A,Power REIT 7.75% Series A Cumulative Perpetual Preferred Stock,$3.4397,0.0077,0.224%,,United States,,201,,
PWFL,PowerFleet Inc. Common Stock,$4.43,-0.31,-6.54%,164850507.00,United States,,703758,Telecommunications,Telecommunications Equipment
PWM,Prestige Wealth Inc. Class A Ordinary Shares,$1.26,-0.07,-5.263%,11529000.00,Hong Kong,2023,84041,,
PWOD,Penns Woods Bancorp Inc. Common Stock,$19.08,0.17,0.899%,143365174.00,United States,,12189,Finance,Major Banks
PW,Power REIT (MD) Common Stock,$0.52,-0.0413,-7.358%,1762624.00,United States,1998,17987,Real Estate,Real Estate Investment Trusts
PWP,Perella Weinberg Partners Class A Common Stock,$15.59,0.35,2.297%,1345795619.00,United States,2020,525695,Finance,Finance: Consumer Services
PWR,Quanta Services Inc. Common Stock,$262.26,-0.94,-0.357%,38224126446.00,United States,,534701,Industrials,Engineering & Construction
PWSC,PowerSchool Holdings Inc. Class A Common Stock,$21.41,0.35,1.662%,4337523731.00,United States,2021,721649,Technology,Computer Software: Prepackaged Software
PWUP,PowerUp Acquisition Corp. Class A Ordinary Shares,$11.05,-0.02,-0.181%,0.00,United States,2022,187,Finance,Blank Checks
PWUPU,PowerUp Acquisition Corp. Unit,$11.0076,0.00,0.00%,0.00,United States,2022,60,Finance,Blank Checks
PWUPW,PowerUp Acquisition Corp. Warrant,$0.0301,0.00,0.00%,0.00,United States,2022,75,Finance,Blank Checks
PXD,Pioneer Natural Resources Company Common Stock,$270.51,-2.27,-0.832%,63197390462.00,United States,,1971658,Energy,Oil & Gas Production
PXDT,Pixie Dust Technologies Inc. American Depositary Shares ,$2.54,0.05,2.008%,37343758.00,Japan,2023,6398,,
PXLW,Pixelworks Inc.  Common Stock,$2.25,0.01,0.446%,130042964.00,United States,2000,298604,Technology,Semiconductors
PXMD,PaxMedica Inc. Common Stock,$0.471,-0.019,-3.878%,3489200.00,United States,2022,64361,Health Care, Medicinal Chemicals and Botanical Products 
PX,P10 Inc. Class A Common Stock,$8.36,-0.04,-0.476%,968732849.00,United States,2021,289950,Finance,Investment Managers
PXSAP,Pyxis Tankers Inc. 7.75% Series A Cumulative Convertible Preferred Shares,$24.725,0.045,0.182%,312878359.00,Greece,,437,Consumer Discretionary,Marine Transportation
PXSAW,Pyxis Tankers Inc. Warrant,$1.29,0.09,7.50%,16324088.00,Greece,,1200,Consumer Discretionary,Marine Transportation
PXS,Pyxis Tankers Inc. Common Stock,$4.74,0.02,0.424%,50955000.00,Greece,,17785,Consumer Discretionary,Marine Transportation
PYCR,Paycor HCM Inc. Common Stock,$18.40,0.33,1.826%,3275752994.00,United States,2021,689986,Technology,Computer Software: Prepackaged Software
PYN,PIMCO New York Municipal Income Fund III Common Shares of Beneficial Interest,$5.74,0.00,0.00%,0.00,United States,2002,12915,Finance,Investment Managers
PYPD,PolyPid Ltd. Ordinary Shares,$4.50,-0.325,-6.736%,7441016.00,Israel,2020,21525,Health Care,Medical/Dental Instruments
PYPL,PayPal Holdings Inc. Common Stock,$66.34,1.19,1.827%,71099355258.00,United States,,8421432,Consumer Discretionary,Business Services
PYT,PPlus Tr GSC-2 Tr Ctf Fltg Rate,$22.85,-0.25,-1.082%,0.00,United States,,760,Finance,Finance: Consumer Services
PYXS,Pyxis Oncology Inc. Common Stock,$5.58,0.12,2.198%,324384233.00,United States,2021,566728,Health Care,Biotechnology: Pharmaceutical Preparations
PZC,PIMCO California Municipal Income Fund III Common Shares of Beneficial Interest,$7.49,-0.04,-0.531%,0.00,United States,2002,27641,Finance,Investment Managers
PZG,Paramount Gold Nevada Corp. Common Stock,$0.4572,-0.0028,-0.609%,27573885.00,United States,2015,153179,Basic Materials,Metal Mining
PZZA,Papa John's International Inc. Common Stock,$63.98,0.24,0.377%,2096437331.00,United States,1993,828568,Consumer Discretionary,Restaurants
QBTS,D-Wave Quantum Inc. Common Shares,$1.85,-0.03,-1.596%,299111929.00,,2022,3524186,Technology,Retail: Computer Software & Peripheral Equipment
QCOM,QUALCOMM Incorporated Common Stock,$173.62,2.09,1.218%,193759920000.00,United States,1991,4812025,Technology,Radio And Television Broadcasting And Communications Equipment
QCRH,QCR Holdings Inc. Common Stock,$58.59,1.12,1.949%,983894839.00,United States,,34848,Finance,Major Banks
QDEL,QuidelOrtho Corporation Common Stock,$43.35,0.65,1.522%,2897925392.00,United States,,583084,Health Care,Medical Specialities
QD,Qudian Inc. American Depositary Shares each representing one Class A Ordinary Share,$2.49,0.07,2.893%,578293352.00,China,2017,1055604,Finance,Finance: Consumer Services
QDRO,Quadro Acquisition One Corp. Class A Ordinary Shares,$11.02,0.01,0.091%,0.00,United States,2021,30067,Finance,Blank Checks
QETA,Quetta Acquisition Corporation Common Stock,$10.22,0.01,0.098%,0.00,United States,2023,5706,,
QFIN,Qifu Technology Inc. American Depositary Shares,$19.60,0.32,1.66%,3163362227.00,China,2018,713914,Finance,Finance: Consumer Services
QGEN,Qiagen N.V. Common Shares,$41.50,0.33,0.802%,9470414333.00,Netherlands,,1147778,Health Care,Biotechnology: Biological Products (No Diagnostic Substances)
QH,Quhuo Limited American Depository Shares,$0.629,0.0492,8.486%,3879434.00,China,2020,1510003,Consumer Discretionary,Business Services
QIPT,Quipt Home Medical Corp. Common Shares,$4.05,0.00,0.00%,170515008.00,United States,,108478,Health Care,Misc Health and Biotechnology Services
QLGN,Qualigen Therapeutics Inc. Common Stock,$0.3815,-0.0137,-3.467%,2406262.00,United States,2015,39182,Health Care,Biotechnology: Pharmaceutical Preparations
QLI,Qilian International Holding Group Ltd. Ordinary Shares,$0.7871,0.007,0.897%,28138825.00,China,2021,17360,Health Care,Biotechnology: Pharmaceutical Preparations
QLYS,Qualys Inc. Common Stock,$166.66,1.82,1.104%,6162629985.00,United States,2012,298901,Technology,EDP Services
QMCO,Quantum Corporation Common Stock,$0.5379,-0.0215,-3.843%,51122343.00,United States,,114435,Technology,Electronic Components
QNCX,Quince Therapeutics Inc. Common Stock,$1.04,0.015,1.463%,44943842.00,United States,2019,19039,Health Care,Biotechnology: Biological Products (No Diagnostic Substances)
QNRX,Quoin Pharmaceuticals Ltd. American Depositary Shares,$0.7801,-0.03,-3.703%,2875425.00,Israel,2016,85699,Health Care,Medical/Dental Instruments
QNST,QuinStreet Inc. Common Stock,$17.55,0.45,2.632%,963328363.00,United States,2010,359567,Consumer Discretionary,Business Services
QOMOR,Qomolangma Acquisition Corp. Right,$0.1232,0.00,0.00%,0.00,United States,2022,2,Finance,Blank Checks
QOMOW,Qomolangma Acquisition Corp. Warrant,$0.02,0.00,0.00%,0.00,United States,2022,502,Finance,Blank Checks
QQQX,Nuveen NASDAQ 100 Dynamic Overwrite Fund Shares of Beneficial Interest,$23.75,-0.08,-0.336%,0.00,United States,,114707,Finance,Finance Companies
QRHC,Quest Resource Holding Corporation Common Stock,$9.07,0.16,1.796%,182954598.00,United States,,9612,Utilities,Environmental Services
QRTEA,Qurate Retail Inc. Series A Common Stock ,$1.05,0.03,2.941%,411335505.00,United States,,1981126,Consumer Discretionary,Catalog/Specialty Distribution
QRTEB,Qurate Retail Inc. Series B Common Stock ,$4.35,0.11,2.594%,1704104235.00,United States,,691,Consumer Discretionary,Catalog/Specialty Distribution
QRTEP,Qurate Retail Inc. 8.0% Fixed Rate Cumulative Redeemable Preferred Stock,$48.85,0.48,0.992%,19136894685.00,United States,,23068,Consumer Discretionary,Catalog/Specialty Distribution
QRVO,Qorvo Inc. Common Stock,$114.46,-0.63,-0.547%,11050936503.00,United States,,640022,Technology,Semiconductors
QSG,QuantaSing Group Limited American Depositary Shares,$3.63,-0.21,-5.469%,200398332.00,China,2023,149822,Real Estate,Other Consumer Services
QSIAW,Quantum-Si Incorporated Warrant,$0.2589,-0.0037,-1.409%,36704232.00,United States,2020,2334,Health Care,Biotechnology: Pharmaceutical Preparations
QSI,Quantum-Si Incorporated Class A Common Stock,$1.82,0.00,0.00%,258021249.00,United States,2020,416392,Health Care,Biotechnology: Pharmaceutical Preparations
QS,QuantumScape Corporation Class A Common Stock,$6.14,0.16,2.676%,3044269851.00,United States,2020,4369480,Consumer Discretionary,Auto Parts:O.E.M.
QSR,Restaurant Brands International Inc. Common Shares,$74.37,-0.18,-0.241%,23224518615.00,Canada,2014,1183391,Consumer Discretionary,Restaurants
QTI,QT Imaging Holdings Inc. Common Stock,$1.065,0.025,2.404%,22830635.00,United States,,78333,Health Care,Biotechnology: Electromedical & Electrotherapeutic Apparatus
QTRX,Quanterix Corporation Common Stock,$21.32,-0.16,-0.745%,811516336.00,United States,2017,175923,Industrials,Biotechnology: Laboratory Analytical Instruments
QTTB,Q32 Bio Inc. Common Stock,$21.42,1.20,5.935%,69178910.00,United States,2018,16482,Health Care,Biotechnology: Pharmaceutical Preparations
QTWO,Q2 Holdings Inc. Common Stock,$53.43,0.97,1.849%,3156335094.00,United States,2014,550297,Technology,Computer Software: Prepackaged Software
QUAD,Quad Graphics Inc Class A Common Stock,$5.26,0.12,2.335%,275004020.00,United States,,95754,Consumer Discretionary,Publishing
QUBT,Quantum Computing Inc. Common Stock,$0.9014,-0.051,-5.355%,82349777.00,United States,,1809843,Technology,Computer Manufacturing
QUIK,QuickLogic Corporation Common Stock,$14.03,-0.25,-1.751%,201713365.00,United States,1999,294639,Technology,Semiconductors
QURE,uniQure N.V. Ordinary Shares,$5.20,0.05,0.971%,248759030.00,Netherlands,2014,563859,Health Care,Biotechnology: Pharmaceutical Preparations
QVCC,QVC Inc. 6.250% Senior Secured Notes due 2068,$13.67,0.00,0.00%,14.00,United States,2019,17803,Consumer Discretionary,Catalog/Specialty Distribution
QVCD,QVC Inc. 6.375% Senior Secured Notes due 2067,$13.72,-0.13,-0.939%,14.00,United States,2018,12332,Consumer Discretionary,Catalog/Specialty Distribution
RA,Brookfield Real Assets Income Fund Inc. Common Stock,$12.97,0.075,0.582%,0.00,United States,2016,612221,Finance,Investment Managers
RACE,Ferrari N.V. Common Shares,$423.55,4.69,1.12%,76416082020.00,Italy,2015,284410,Consumer Discretionary,Auto Manufacturing
RAIL,FreightCar America Inc. Common Stock,$3.87,-0.10,-2.519%,70997039.00,United States,2005,135718,Industrials,Railroads
RAMP,LiveRamp Holdings Inc. Common Stock,$35.37,-1.16,-3.175%,2340918565.00,United States,2018,544662,Technology,EDP Services
RAND,Rand Capital Corporation Common Stock,$13.9706,0.2206,1.604%,36058412.00,United States,,767,Finance,Finance/Investors Services
RANI,Rani Therapeutics Holdings Inc. Class A Common Stock,$3.73,0.03,0.811%,187086699.00,United States,2021,53773,Health Care, Medicinal Chemicals and Botanical Products 
RAPT,RAPT Therapeutics Inc. Common Stock,$8.32,0.42,5.316%,289516881.00,United States,2019,1143533,Health Care,Biotechnology: Pharmaceutical Preparations
RARE,Ultragenyx Pharmaceutical Inc. Common Stock,$50.23,-0.01,-0.02%,4135721558.00,United States,2014,488911,Health Care,Biotechnology: Pharmaceutical Preparations
RAVE,Rave Restaurant Group Inc. Common Stock,$2.21,0.03,1.376%,32236311.00,United States,,8081,Consumer Discretionary,Restaurants
RAYA,Erayak Power Solution Group Inc. Class A Ordinary Shares,$0.6425,-0.0645,-9.123%,7999125.00,China,2022,222756,Consumer Discretionary,Metal Fabrications
RBA,RB Global Inc. Common Stock,$74.60,-0.09,-0.12%,13653051042.00,Canada,,457386,,
RBBN,Ribbon Communications Inc. Common Stock,$2.97,-0.02,-0.669%,512211323.00,United States,,249845,Technology,EDP Services
RBB,RBB Bancorp Common Stock,$17.60,0.14,0.802%,327743346.00,United States,2017,31194,Finance,Major Banks
RBCAA,Republic Bancorp Inc. Class A Common Stock,$49.79,-0.58,-1.151%,966067802.00,United States,1998,10339,Finance,Major Banks
RBCP,RBC Bearings Incorporated 5.00% Series A Mandatory Convertible Preferred Stock,$122.45,2.80,2.34%,3573326226.00,United States,2022,254,Industrials,Metal Fabrications
RBC,RBC Bearings Incorporated Common Stock,$269.54,3.51,1.319%,7865694986.00,United States,2022,98152,Industrials,Metal Fabrications
RBKB,Rhinebeck Bancorp Inc. Common Stock,$8.03,0.03,0.375%,88913034.00,United States,2019,318,Finance,Major Banks
RBLX,Roblox Corporation Class A Common Stock,$38.22,0.40,1.058%,24141212960.00,United States,2021,5981242,Technology,EDP Services
RBOT,Vicarious Surgical Inc. Class A Common Stock,$0.2978,0.0238,8.686%,52338848.00,Hong Kong,2020,871267,Health Care,Medical Specialities
RBT,Rubicon Technologies Inc. Class A Common Stock,$0.3616,-0.0257,-6.636%,19330299.00,,2022,241992,Technology,Computer Software: Prepackaged Software
RCAT,Red Cat Holdings Inc. Common Stock,$0.8201,0.0391,5.006%,60918275.00,United States,,192248,Industrials,Wholesale Distributors
RCB,Ready Capital Corporation 6.20% Senior Notes due 2026,$24.34,-0.10,-0.409%,4199977114.00,United States,2019,3270,Real Estate,Real Estate Investment Trusts
RCC,Ready Capital Corporation 5.75% Senior Notes due 2026,$24.21,0.01,0.041%,4177545026.00,United States,2021,3625,Real Estate,Real Estate Investment Trusts
RCEL,Avita Medical Inc. Common Stock,$15.13,-0.26,-1.689%,388941796.00,United States,,139690,Health Care,Medical/Dental Instruments
RC^E,Ready Capital Corporation 6.50% Series E Cumulative Redeemable Preferred Stock,$18.74,0.08,0.429%,,United States,,4955,,
RCFA,RCF Acquisition Corp. Class A Ordinary Shares,$11.17,0.00,0.00%,0.00,,2021,110,Finance,Blank Checks
RCG,RENN Fund Inc Common Stock,$1.64,0.0201,1.241%,0.00,United States,,20455,Finance,Investment Managers
RCI,Rogers Communication Inc. Common Stock,$39.67,0.05,0.126%,21075265452.00,Canada,,354773,Telecommunications,Cable & Other Pay Television Services
RCKT,Rocket Pharmaceuticals Inc. Common Stock,$24.39,-0.62,-2.479%,2207398609.00,United States,2015,726186,Health Care,Biotechnology: Pharmaceutical Preparations
RCKTW,Rocket Pharmaceuticals Inc. Warrant,$0.1773,-0.0038,-2.098%,,United States,,1564,Health Care,Biotechnology: Pharmaceutical Preparations
RCKY,Rocky Brands Inc. Common Stock,$27.08,0.30,1.12%,200867146.00,United States,1993,13364,Consumer Discretionary,Shoe Manufacturing
RCL,Royal Caribbean Cruises Ltd. Common Stock,$138.29,2.27,1.669%,35492148829.00,United States,1993,1596350,Consumer Discretionary,Marine Transportation
RCM,R1 RCM Inc. Common Stock,$12.77,0.30,2.406%,5366978588.00,United States,,1355720,Consumer Discretionary,Other Consumer Services
RCMT,RCM Technologies Inc. Common Stock,$19.95,-0.38,-1.869%,158391409.00,United States,,92620,Consumer Discretionary,Professional Services
RCON,Recon Technology Ltd. Class A Ordinary Shares,$0.1375,0.0025,1.852%,5572630.00,China,2009,99574,Energy,Oilfield Services/Equipment
RC,Ready Capital Corproation Common Stock,$8.71,-0.09,-1.023%,1502949904.00,United States,2013,825840,Real Estate,Real Estate Investment Trusts
RCRT,Recruiter.com Group Inc. Common Stock,$1.497,-0.123,-7.593%,2146553.00,United States,,3234,Technology,EDP Services
RCRTW,Recruiter.com Group Inc. Warrant,$0.0079,-0.0001,-1.25%,11328.00,United States,,5600,Technology,EDP Services
RCS,PIMCO Strategic Income Fund Inc.,$6.12,0.01,0.164%,0.00,United States,1994,52868,Finance,Investment Managers
RCUS,Arcus Biosciences Inc. Common Stock,$16.97,-0.37,-2.134%,1541976148.00,United States,2018,285883,Health Care,Biotechnology: Pharmaceutical Preparations
RDCM,Radcom Ltd. Ordinary Shares,$10.75,-0.0246,-0.228%,164558119.00,Israel,1997,32919,Technology,Computer peripheral equipment
RDDT,Reddit Inc. Class A Common Stock,$46.15,-1.41,-2.965%,7337531104.00,,2024,2661470,,
RDFN,Redfin Corporation Common Stock,$6.19,0.01,0.162%,738105046.00,United States,2017,2642304,Finance,Real Estate
RDHL,Redhill Biopharma Ltd. American Depositary Shares,$0.524,-0.005,-0.945%,15564386.00,Israel,,216247,Health Care,Biotechnology: Pharmaceutical Preparations
RDIB,Reading International Inc Class B Common Stock,$14.50,0.50,3.571%,324158738.00,United States,,2968,Consumer Discretionary,Movies/Entertainment
RDI,Reading International Inc Class A Common Stock,$1.79,0.00,0.00%,40016837.00,United States,,8948,Consumer Discretionary,Movies/Entertainment
RDN,Radian Group Inc. Common Stock,$31.83,0.46,1.466%,4822184459.00,United States,,1026428,Finance,Property-Casualty Insurers
RDNT,RadNet Inc. Common Stock,$48.87,-0.17,-0.347%,3346394899.00,United States,,299286,Health Care,Medical Specialities
RDUS,Radius Recycling Inc. Class A Common Stock,$20.17,0.19,0.951%,564400187.00,United States,,246667,Consumer Discretionary,Industrial Specialties
RDVT,Red Violet Inc. Common Stock ,$20.26,0.00,0.00%,282911207.00,United States,,21531,Technology,Computer Software: Prepackaged Software
RDW,Redwire Corporation Common Stock,$4.41,0.04,0.915%,289202173.00,United States,2021,132384,Industrials,Military/Government/Technical
RDWR,Radware Ltd. Ordinary Shares,$17.76,-0.06,-0.337%,740572038.00,Israel,1999,238948,Technology,EDP Services
RDY,Dr. Reddy's Laboratories Ltd Common Stock,$73.70,-0.06,-0.081%,12273104461.00,India,,103708,Health Care,Biotechnology: Pharmaceutical Preparations
RDZN,Roadzen Inc. Ordinary Shares,$6.50,-0.17,-2.549%,444865389.00,United States,2022,2016,Finance,Blank Checks
RDZNW,Roadzen Inc. Warrants,$0.10,-0.02,-16.667%,6844083.00,United States,2022,2200,Finance,Blank Checks
REAL,The RealReal Inc. Common Stock,$3.59,0.045,1.269%,375845755.00,United States,2019,1024800,Consumer Discretionary,Consumer Specialties
REAX,The Real Brokerage Inc. Common Shares,$4.24,0.15,3.667%,778488511.00,Canada,,1260490,,
REBN,Reborn Coffee Inc. Common Stock,$1.12,-0.09,-7.438%,3042338.00,United States,2022,60769,Consumer Discretionary,Restaurants
REE,REE Automotive Ltd. Class A Ordinary Shares,$4.50,-0.25,-5.263%,50547735.00,Israel,,26330,Consumer Discretionary,Auto Manufacturing
REFI,Chicago Atlantic Real Estate Finance Inc. Common Stock,$15.61,-0.11,-0.70%,284058167.00,United States,2021,66132,Real Estate,Real Estate Investment Trusts
REFR,Research Frontiers Incorporated Common Stock,$1.27,0.00,0.00%,42556794.00,United States,,7657,Miscellaneous,Multi-Sector Companies
REGCO,Regency Centers Corporation 5.875% Series B Cumulative Redeemable Preferred Stock,$23.29,0.00,0.00%,4298834523.00,United States,,7303,,
REGCP,Regency Centers Corporation 6.25% Series A Cumulative Redeemable Preferred Stock,$24.00,-0.10,-0.415%,4429885296.00,United States,,4103,,
REGN,Regeneron Pharmaceuticals Inc. Common Stock,$938.48,-4.22,-0.448%,103009344158.00,United States,1991,330917,Health Care,Biotechnology: Pharmaceutical Preparations
REG,Regency Centers Corporation Common Stock,$59.19,0.39,0.663%,10925204611.00,United States,1993,1216552,Real Estate,Real Estate Investment Trusts
REI,Ring Energy Inc. Common Stock,$2.07,0.03,1.471%,409723798.00,United States,,1895331,Energy,Oil & Gas Production
REKR,Rekor Systems Inc. Common Stock,$2.33,-0.08,-3.32%,198807059.00,United States,,794407,Telecommunications,Telecommunications Equipment
RELI,Reliance Global Group Inc. Common Stock,$0.4235,-0.0612,-12.626%,2410726.00,United States,,1280546,Finance,Specialty Insurers
RELIW,Reliance Global Group Inc. Series A Warrants,$0.0473,0.00,0.00%,269250.00,United States,,100,Finance,Specialty Insurers
RELL,Richardson Electronics Ltd. Common Stock,$9.21,0.07,0.766%,131504442.00,United States,1983,98370,Technology,Electronic Components
RELX,RELX PLC PLC American Depositary Shares (Each representing One Ordinary Share),$41.92,-0.12,-0.285%,78936334221.00,United Kingdom,2015,1737058,Consumer Discretionary,Business Services
RELY,Remitly Global Inc. Common Stock,$20.97,0.32,1.55%,3952953478.00,United States,2021,952228,Technology,Computer Software: Prepackaged Software
RENB,Renovaro Inc. Common Stock,$2.85,0.09,3.261%,409454860.00,United States,,165117,Health Care,Biotechnology: Pharmaceutical Preparations
RENE,Cartesian Growth Corporation II Class A Ordinary Shares,$11.14,0.01,0.09%,0.00,United States,2022,6936,Finance,Blank Checks
RENEW,Cartesian Growth Corporation II Warrant,$0.1011,-0.0212,-17.334%,0.00,United States,2022,534,Finance,Blank Checks
RENT,Rent the Runway Inc. Class A Common Stock,$5.28,0.50,10.46%,18720404.00,United States,2021,71928,Consumer Discretionary,Other Specialty Stores
REPL,Replimune Group Inc. Common Stock,$7.12,-0.24,-3.261%,437081036.00,United States,2018,574896,Health Care,Biotechnology: Pharmaceutical Preparations
REPX,Riley Exploration Permian Inc. Common Stock,$29.60,1.03,3.605%,603840947.00,United States,1999,334884,Energy,Oil & Gas Production
RERE,ATRenew Inc. American Depositary Shares (every three of which representing two Class A ordinary shares),$1.69,0.03,1.807%,378262878.00,Cayman Islands,2021,869236,Consumer Discretionary,Other Specialty Stores
RES,RPC Inc. Common Stock,$7.90,-0.08,-1.003%,1702018644.00,United States,,889665,Energy,Oilfield Services/Equipment
RETO,ReTo Eco-Solutions Inc. Common Shares,$1.26,0.02,1.613%,4718938.00,China,2017,301759,Consumer Discretionary,Multi-Sector Companies
