DENN,Denny's Corporation Common Stock,$8.78,0.34,4.028%,458787653.00,United States,,810813,Consumer Discretionary,Restaurants
DEO,Diageo plc Common Stock,$143.31,-1.13,-0.782%,80035221069.00,United Kingdom,,525796,Consumer Staples,Beverages (Production/Distribution)
DERM,Journey Medical Corporation Common Stock,$4.11,0.43,11.685%,81921794.00,United States,2021,272430,Health Care,Biotechnology: Pharmaceutical Preparations
DESP,Despegar.com Corp. Ordinary Shares,$12.05,0.22,1.86%,796023000.00,Argentina,2017,652852,Consumer Discretionary,Transportation Services
DFH,Dream Finders Homes Inc. Class A Common Stock,$42.09,-0.83,-1.934%,3925579493.00,United States,2022,410396,Consumer Discretionary,Homebuilding
DFIN,Donnelley Financial Solutions Inc. Common Stock ,$60.83,-0.15,-0.246%,1769559543.00,United States,2016,89221,Consumer Discretionary,Other Consumer Services
DFLI,Dragonfly Energy Holdings Corp. Common Stock (NV),$0.4656,-0.0294,-5.939%,27726858.00,United States,2021,315496,Technology,Electronic Components
DFLIW,Dragonfly Energy Holdings Corp. Warrant,$0.0339,-0.0013,-3.693%,2018773.00,United States,2021,2500,Technology,Electronic Components
DFP,Flaherty & Crumrine Dynamic Preferred and Income Fund Inc. Common Stock,$18.74,0.00,0.00%,0.00,,2013,17620,Finance,Investment Managers
DFS,Discover Financial Services Common Stock,$125.71,-0.15,-0.119%,31497306009.00,United States,,1002053,Finance,Finance: Consumer Services
DG,Dollar General Corporation Common Stock,$156.74,-2.81,-1.761%,34431282070.00,United States,2009,2637786,Consumer Discretionary,Department/Specialty Retail Stores
DGHI,Digihost Technology Inc. Common Subordinate Voting Shares,$1.40,-0.05,-3.448%,41062209.00,Canada,,30377,Finance,Finance: Consumer Services
DGICA,Donegal Group Inc. Class A Common Stock,$13.74,-0.03,-0.218%,458825714.00,United States,,37164,Finance,Property-Casualty Insurers
DGICB,Donegal Group Inc. Class B Common Stock,$13.54,0.719,5.608%,452147029.00,United States,1986,3978,Finance,Property-Casualty Insurers
DGII,Digi International Inc. Common Stock,$32.24,1.35,4.37%,1168913171.00,United States,1989,179671,Telecommunications,Computer Communications Equipment
DGLY,Digital Ally Inc. Common Stock,$2.35,-0.085,-3.491%,6581767.00,United States,,57001,Technology,Radio And Television Broadcasting And Communications Equipment
DGX,Quest Diagnostics Incorporated Common Stock,$130.04,-0.59,-0.452%,14396376382.00,United States,,595109,Health Care,Medical Specialities
DHAC,Digital Health Acquisition Corp. Common Stock,$12.35,0.23,1.898%,44508980.00,United States,2021,8725,Health Care,Medical/Nursing Services
DHACW,Digital Health Acquisition Corp. Warrant,$0.1501,0.00,0.00%,540955.00,United States,2021,40066,Health Care,Medical/Nursing Services
DHAI,DIH Holdings US Inc. Class A Common Stock,$1.13,0.03,2.727%,12385130.00,United States,2024,87743,,
DHC,Diversified Healthcare Trust Common Shares of Beneficial Interest,$2.71,0.12,4.633%,651533764.00,United States,,676728,Real Estate,Real Estate Investment Trusts
DHCNI,Diversified Healthcare Trust 5.625% Senior Notes due 2042,$14.9805,-0.1195,-0.791%,3601587287.00,United States,,14333,Real Estate,Real Estate Investment Trusts
DHCNL,Diversified Healthcare Trust 6.25% Senior Notes Due 2046,$15.3826,-0.3574,-2.271%,3698259511.00,United States,,11751,Real Estate,Real Estate Investment Trusts
DH,Definitive Healthcare Corp. Class A Common Stock,$7.80,-0.12,-1.515%,918239595.00,United States,2021,363407,Technology,Computer Software: Prepackaged Software
DHF,BNY Mellon High Yield Strategies Fund Common Stock,$2.36,0.00,0.00%,0.00,United States,1998,475903,Finance,Finance Companies
DHI,D.R. Horton Inc. Common Stock,$156.74,-1.78,-1.123%,52009040781.00,United States,,1513102,Consumer Discretionary,Homebuilding
DHIL,Diamond Hill Investment Group Inc. Class A Common Stock,$152.22,2.76,1.847%,432850509.00,United States,,12248,Finance,Investment Managers
DHR,Danaher Corporation Common Stock,$244.25,-0.03,-0.012%,180672146331.00,United States,,2425994,Industrials,Industrial Machinery/Components
DHT,DHT Holdings Inc.,$11.51,-0.13,-1.117%,1853104728.00,Jersey,2005,796770,Consumer Discretionary,Marine Transportation
DHX,DHI Group Inc. Common Stock,$2.35,-0.04,-1.674%,112876344.00,United States,2007,263278,Consumer Discretionary,Business Services
DHY,Credit Suisse High Yield Bond Fund Common Stock,$2.06,0.03,1.478%,0.00,United States,1998,1143266,Finance,Finance/Investors Services
DIAX,Nuveen Dow 30SM Dynamic Overwrite Fund Common Shares of Beneficial Interest,$14.14,-0.01,-0.071%,0.00,,2014,54270,Finance,Finance Companies
DIBS,1stdibs.com Inc. Common Stock,$5.86,-0.04,-0.678%,232910452.00,United States,2021,108986,Consumer Discretionary,Catalog/Specialty Distribution
DIN,Dine Brands Global Inc. Common Stock,$44.37,1.15,2.661%,676773170.00,United States,,332461,Consumer Discretionary,Restaurants
DINO,HF Sinclair Corporation Common Stock,$62.42,-1.29,-2.025%,12394639403.00,United States,1960,1447390,Energy,Natural Gas Distribution
DIOD,Diodes Incorporated Common Stock,$69.39,1.50,2.209%,3187763000.00,United States,,309583,Technology,Semiconductors
DIST,Distoken Acquisition Corporation Ordinary Shares,$10.78,0.00,0.00%,0.00,China,2023,4817,Finance,Blank Checks
DISTR,Distoken Acquisition Corporation Right,$0.11,0.0063,6.075%,0.00,China,2023,3489,Finance,Blank Checks
DISTW,Distoken Acquisition Corporation Warrant,$0.0202,-0.0008,-3.81%,0.00,China,2023,2539,Finance,Blank Checks
DIS,Walt Disney Company (The) Common Stock,$117.35,-1.03,-0.87%,215255367277.00,United States,,6266011,Consumer Discretionary,Movies/Entertainment
DIT,AMCON Distributing Company Common Stock,$177.75,1.06,0.60%,112046846.00,United States,1999,89,Consumer Discretionary,Food Distributors
DJCO,Daily Journal Corp. (S.C.) Common Stock,$374.01,3.06,0.825%,515021494.00,United States,,4375,Consumer Discretionary,Newspapers/Magazines
DJT,Trump Media & Technology Group Corp. Common Stock,$37.17,-3.42,-8.426%,5081160670.00,United States,2024,7573677,Technology,Computer Software: Programming Data Processing
DJTWW,Trump Media & Technology Group Corp. Warrants,$13.90,0.10,0.725%,1900138104.00,United States,2021,276932,Technology,Computer Software: Programming Data Processing
DK,Delek US Holdings Inc. Common Stock,$32.37,-1.02,-3.055%,2072303673.00,United States,2017,959783,Energy,Integrated oil Companies
DKL,Delek Logistics Partners L.P. Common Units representing Limited Partner Interests,$39.07,-0.66,-1.661%,1704108806.00,United States,2012,140560,Energy,Natural Gas Distribution
DKNG,DraftKings Inc. Class A Common Stock,$45.51,-1.69,-3.581%,39440489629.00,United States,2019,10143315,Consumer Discretionary,Services-Misc. Amusement & Recreation
DKS,Dick's Sporting Goods Inc Common Stock,$207.55,-1.20,-0.575%,17112151929.00,United States,2002,1322720,Consumer Discretionary,Other Specialty Stores
DLA,Delta Apparel Inc. Common Stock,$2.79,0.04,1.455%,19672709.00,United States,2000,24740,Consumer Staples,Apparel
DLB,Dolby Laboratories Common Stock,$83.17,0.66,0.80%,7949291541.00,United States,2005,231053,Technology,EDP Services
DLHC,DLH Holdings Corp.,$12.78,-0.26,-1.994%,181868448.00,United States,,27061,Consumer Discretionary,Business Services
DLNG^A,Dynagas LNG Partners LP 9.00% Series A Cumulative Redeemable Preferred Units,$25.41,0.02,0.079%,,Greece,,3473,,
DLNG^B,Dynagas LNG Partners LP 8.75% Series B Fixed to Floating Rate Cumulative Redeemable Perpetual Preferred Units liquidation preference $25.00 per Uni,$25.75,-0.04,-0.155%,,Greece,,1374,,
DLNG,Dynagas LNG Partners LP Common Units,$3.02,-0.02,-0.658%,111142786.00,Greece,,54322,Consumer Discretionary,Marine Transportation
DLO,DLocal Limited Class A Common Shares,$16.62,0.37,2.277%,4919381472.00,Uruguay,2021,623074,Consumer Discretionary,Business Services
DLPN,Dolphin Entertainment Inc. Common Stock,$1.20,0.05,4.348%,22384624.00,United States,,16858,Consumer Discretionary,Other Consumer Services
DLR,Digital Realty Trust Inc. Common Stock,$143.34,0.74,0.519%,44764159320.00,United States,2004,1152541,Real Estate,Real Estate Investment Trusts
DLR^J,Digital Realty Trust Inc. 5.250% Series J Cumulative Redeemable Preferred Stock,$21.83,-0.01,-0.046%,,United States,,15492,,
DLR^K,Digital Realty Trust Inc. 5.850% Series K Cumulative Redeemable Preferred Stock par value $0.01 per share,$23.77,0.07,0.295%,,United States,,32958,,
DLR^L,Digital Realty Trust Inc. 5.200% Series L Cumulative Redeemable Preferred Stock,$21.72,0.04,0.185%,,United States,,17707,,
DLTH,Duluth Holdings Inc. Class B Common Stock,$4.94,0.06,1.23%,169993877.00,United States,2015,67158,Consumer Discretionary,Clothing/Shoe/Accessory Stores
DLTR,Dollar Tree Inc. Common Stock,$128.22,-2.49,-1.905%,27949782568.00,United States,1995,3402685,Consumer Discretionary,Department/Specialty Retail Stores
DLX,Deluxe Corporation Common Stock,$19.93,0.16,0.809%,873932015.00,United States,,110306,Consumer Discretionary,Advertising
DLY,DoubleLine Yield Opportunities Fund Common Shares of Beneficial Interest,$15.72,-0.22,-1.38%,753707646.00,United States,2020,234323,Finance,Investment Managers
DMAC,DiaMedica Therapeutics Inc. Common Stock,$2.78,-0.20,-6.711%,105523240.00,United States,2018,20587,Health Care,Pharmaceuticals and Biotechnology
DMA,Destra Multi-Alternative Fund Common Stock,$7.34,-0.14,-1.872%,0.00,,2022,14334,Finance,Trusts Except Educational Religious and Charitable
DMB,BNY Mellon Municipal Bond Infrastructure Fund Inc. Common Stock,$10.21,0.05,0.492%,0.00,,2013,56526,Finance,Trusts Except Educational Religious and Charitable
DM,Desktop Metal Inc. Class A Common Stock,$1.08,0.1483,15.917%,356007434.00,United States,2019,3500772,Technology,Computer peripheral equipment
DMF,BNY Mellon Municipal Income Inc. Common Stock,$6.72,0.005,0.074%,418594539.00,United States,1988,31545,Finance,Finance/Investors Services
DMLP,Dorchester Minerals L.P. Common Units Representing Limited Partnership Interests,$34.40,-0.53,-1.517%,1361663559.00,United States,,73023,Energy,Oil & Gas Production
DMO,Western Asset Mortgage Opportunity Fund Inc. Common Stock,$11.69,-0.14,-1.183%,0.00,United States,2010,69590,Finance,Trusts Except Educational Religious and Charitable
DMRC,Digimarc Corporation Common Stock,$24.66,0.17,0.694%,504139077.00,United States,,100986,Technology,EDP Services
DMTK,DermTech Inc. Common Stock,$0.649,0.029,4.677%,22470615.00,United States,2017,82085,Health Care,Medical Specialities
DMYY,dMY Squared Technology Group Inc. Class A Common Stock,$10.70,0.00,0.00%,0.00,,2022,316,Finance,Blank Checks
DNA,Ginkgo Bioworks Holdings Inc. Class A Common Stock,$1.11,0.03,2.778%,2389159322.00,United States,2021,14581836,Health Care,Biotechnology: Biological Products (No Diagnostic Substances)
DNB,Dun & Bradstreet Holdings Inc. Common Stock,$9.61,0.12,1.264%,4216829925.00,United States,2020,2849046,Finance,Finance: Consumer Services
DNLI,Denali Therapeutics Inc. Common Stock,$19.04,-0.35,-1.805%,2649610951.00,United States,2017,865031,Health Care,Biotechnology: Biological Products (No Diagnostic Substances)
DNMR,Danimer Scientific Inc. Common Stock,$1.05,0.00,0.00%,119952967.00,United States,2020,1026469,Industrials,Plastic Products
DNN,Denison Mines Corp Ordinary Shares (Canada),$2.07,-0.07,-3.271%,1844362488.00,Canada,,13939800,Basic Materials,Other Metals and Minerals
DNOW,DNOW Inc. Common Stock,$15.43,0.27,1.781%,1638142861.00,United States,2014,620809,Industrials,Metal Fabrications
DNP,DNP Select Income Fund Inc. Common Stock,$8.98,0.01,0.111%,0.00,United States,1987,338632,Finance,Investment Managers
DNTH,Dianthus Therapeutics Inc. Common Stock,$23.58,-1.51,-6.018%,691996601.00,United States,2018,95249,Health Care,Biotechnology: Pharmaceutical Preparations
DNUT,Krispy Kreme Inc. Common Stock,$14.32,-1.01,-6.588%,2415784000.00,United States,2021,8686676,Consumer Staples,Food Chains
DOC,Healthpeak Properties Inc. Common Stock,$18.98,0.35,1.879%,10385343217.00,United States,,5796912,Real Estate,Real Estate Investment Trusts
DOCN,DigitalOcean Holdings Inc. Common Stock,$37.48,0.16,0.429%,3403060129.00,United States,2021,631359,Technology,Retail: Computer Software & Peripheral Equipment
DOCS,Doximity Inc. Class A Common Stock,$25.78,-0.03,-0.116%,4809355675.00,United States,2021,3215883,Technology,Retail: Computer Software & Peripheral Equipment
DOCU,DocuSign Inc. Common Stock,$59.66,0.19,0.319%,12255066596.00,United States,2018,1331938,Technology,Computer Software: Prepackaged Software
DO,Diamond Offshore Drilling Inc. Common Stock,$14.26,-0.32,-2.195%,1461180946.00,United States,2022,1351289,Energy,Oil & Gas Production
DOGZ,Dogness (International) Corporation Class A Common Stock,$9.70,1.65,20.497%,103031101.00,China,2017,128445,Consumer Discretionary,Miscellaneous manufacturing industries
DOLE,Dole plc Ordinary Shares,$11.82,0.12,1.026%,1122062896.00,Ireland,2021,316312,Consumer Staples,Farming/Seeds/Milling
DOMA,Doma Holdings Inc. Common Stock,$6.05,0.00,0.00%,84021021.00,United States,2021,33620,Finance,Real Estate
DOMH,Dominari Holdings Inc. Common Stock,$2.83,-0.31,-9.873%,16795815.00,United States,,35789,Health Care,Biotechnology: Pharmaceutical Preparations
DOMO,Domo Inc. Class B Common Stock,$8.80,-0.04,-0.452%,334674648.00,United States,2018,288180,Technology,Computer Software: Prepackaged Software
DOOO,BRP Inc. (Recreational Products) Common Subordinate Voting Shares,$72.07,-0.64,-0.88%,5402112721.00,Canada,,83887,Consumer Discretionary,Industrial Specialties
DOOR,Masonite International Corporation Ordinary Shares (Canada),$130.88,0.13,0.099%,2870519318.00,Canada,,269789,Basic Materials,Forest Products
DORM,Dorman Products Inc. Common Stock,$95.82,-0.55,-0.571%,2978683708.00,United States,,134310,Consumer Discretionary,Auto Parts:O.E.M.
DOUG,Douglas Elliman Inc. Common Stock,$1.53,-0.07,-4.375%,140049180.00,United States,2021,831874,Real Estate,Building operators
DOV,Dover Corporation Common Stock,$176.08,0.24,0.136%,24633005654.00,United States,,1061980,Industrials,Industrial Machinery/Components
DOW,Dow Inc. Common Stock ,$59.52,-0.17,-0.285%,41800505132.00,United States,2019,3775901,Industrials,Major Chemicals
DOX,Amdocs Limited Ordinary Shares,$87.32,-0.51,-0.581%,10246811555.00,Guernsey,,558445,Technology,EDP Services
DOYU,DouYu International Holdings Limited ADS,$7.77,-0.06,-0.766%,248466457.00,China,2019,75366,Technology,Computer Software: Programming Data Processing
DPCS,DP Cap Acquisition Corp I Class A Ordinary Shares,$11.09,0.00,0.00%,0.00,United States,2021,65,Finance,Blank Checks
DPG,Duff & Phelps Utility and Infrastructure Fund Inc.,$9.40,0.04,0.427%,0.00,United States,2011,77141,Finance,Trusts Except Educational Religious and Charitable
DPRO,Draganfly Inc. Common Shares,$0.2279,0.0072,3.262%,11087390.00,Canada,,518108,Industrials,Aerospace
DPSI,DecisionPoint Systems Inc. Common Stock,$8.7169,-0.3696,-4.068%,66948703.00,,2022,2571,Technology,Retail: Computer Software & Peripheral Equipment
DPZ,Domino's Pizza Inc Common Stock,$501.98,8.78,1.78%,17475290692.00,United States,2004,762628,Consumer Discretionary,Food Distributors
DQ,DAQO New Energy Corp. American Depositary Shares each representing five ordinary shares,$25.92,-1.12,-4.142%,2027064917.00,China,2010,860190,Technology,Semiconductors
DRCT,Direct Digital Holdings Inc. Class A Common Stock,$11.52,-1.09,-8.644%,164395296.00,United States,2022,164706,Technology,Computer Software: Programming Data Processing
DRD,DRDGOLD Limited American Depositary Shares,$8.76,-0.11,-1.24%,757379710.00,South Africa,,317161,Basic Materials,Precious Metals
DRH^A,Diamondrock Hospitality Company 8.250% Series A Cumulative Redeemable Preferred Stock,$25.35,-0.01,-0.039%,,United States,,963,,
DRH,Diamondrock Hospitality Company Common Stock,$9.50,0.06,0.636%,1991458372.00,United States,2005,1160989,Real Estate,Real Estate Investment Trusts
DRI,Darden Restaurants Inc. Common Stock,$157.94,1.59,1.017%,18851552089.00,United States,,1484583,Consumer Discretionary,Restaurants
DRIO,DarioHealth Corp. Common Stock,$1.43,0.08,5.926%,42102821.00,Israel,,186798,Health Care,Medical/Dental Instruments
DRMA,Dermata Therapeutics Inc. Common Stock,$0.4249,0.0099,2.386%,2830191.00,United States,2021,138674,Health Care,Biotechnology: Pharmaceutical Preparations
DRQ,Dril-Quip Inc. Common Stock,$23.18,-0.02,-0.086%,797714341.00,United States,1997,158491,Industrials,Metal Fabrications
DRRX,DURECT Corporation Common Stock,$0.9005,-0.0312,-3.349%,27947901.00,United States,2000,151542,Health Care,Biotechnology: Pharmaceutical Preparations
DRS,Leonardo DRS Inc. Common Stock,$21.17,0.27,1.292%,5559875237.00,Israel,,949870,Industrials,Military/Government/Technical
DRTS,Alpha Tau Medical Ltd. Ordinary Shares,$2.86,-0.0399,-1.376%,199257950.00,Israel,,13805,Health Care,Biotechnology: Pharmaceutical Preparations
DRTSW,Alpha Tau Medical Ltd. Warrant,$0.2514,-0.0105,-4.009%,17515192.00,Israel,,69205,Health Care,Medical/Dental Instruments
DRUG,Bright Minds Biosciences Inc. Common Stock,$1.21,0.04,3.419%,5401243.00,Canada,,6499,Health Care,Pharmaceuticals and Biotechnology
DRVN,Driven Brands Holdings Inc. Common Stock,$14.95,0.05,0.336%,2451375435.00,United States,2021,512193,Consumer Discretionary,Automotive Aftermarket
DSAQ,Direct Selling Acquisition Corp. Class A Common Stock,$11.12,0.06,0.542%,0.00,,2021,144,Finance,Blank Checks
DSGN,Design Therapeutics Inc. Common Stock,$3.76,0.00,0.00%,212418459.00,United States,2021,348568,Health Care,Biotechnology: Pharmaceutical Preparations
DSGR,Distribution Solutions Group Inc. Common Stock,$35.94,0.39,1.097%,1681392988.00,United States,,50594,Industrials,Industrial Machinery/Components
DSGX,Descartes Systems Group Inc. (The) Common Stock,$90.27,0.56,0.624%,7689510483.00,Canada,,94039,,
DSL,DoubleLine Income Solutions Fund Common Shares of Beneficial Interests,$12.50,-0.08,-0.636%,1274960350.00,United States,2013,297708,Finance,Trusts Except Educational Religious and Charitable
DSM,BNY Mellon Strategic Municipal Bond Fund Inc. Common Stock,$5.72,0.00,0.00%,0.00,United States,1989,124830,Finance,Investment Managers
DSP,Viant Technology Inc. Class A Common Stock,$10.29,-0.71,-6.455%,646508259.00,United States,2021,310042,Technology,EDP Services
DSS,DSS Inc. Common Stock,$1.995,0.118,6.287%,14098210.00,United States,,66293,Consumer Discretionary,Containers/Packaging
DSU,Blackrock Debt Strategies Fund Inc. Common Stock,$10.83,0.02,0.185%,0.00,United States,1998,141421,Finance,Finance Companies
DSWL,Deswell Industries Inc. Common Shares,$2.24,0.00,0.00%,35694935.00,Macau,1995,5894,Industrials,Plastic Products
DSX^B,Diana Shipping Inc. Perpetual Preferred Shares Series B (Marshall Islands),$26.756,0.056,0.21%,,Greece,,2466,,
DSX,Diana Shipping inc. common stock,$2.94,-0.01,-0.339%,345928976.00,Greece,2005,403242,Consumer Discretionary,Marine Transportation
DTB,DTE Energy Company 2020 Series G 4.375% Junior Subordinated Debentures due 2080,$20.34,-0.12,-0.587%,4199253715.00,United States,2020,20360,Utilities,Electric Utilities: Central
DTCK,Davis Commodities Limited Ordinary Shares,$1.10,0.04,3.774%,26771250.00,Singapore,2023,8294,Industrials,Farming/Seeds/Milling
DTC,Solo Brands Inc. Class A Common Stock,$2.02,0.11,5.759%,184175480.00,United States,2021,608781,Consumer Discretionary,Recreational Games/Products/Toys
DT,Dynatrace Inc. Common Stock,$47.09,1.11,2.414%,13938604494.00,United States,2019,4497409,Technology,Computer Software: Prepackaged Software
DTE,DTE Energy Company Common Stock,$109.50,0.40,0.367%,22606601858.00,United States,,1163565,Utilities,Electric Utilities: Central
DTF,DTF Tax-Free Income 2028 Term Fund Inc. Common Stock,$10.75,0.055,0.514%,75567845.00,United States,1991,24422,Finance,Investment Managers
DTG,DTE Energy Company 2021 Series E 4.375% Junior Subordinated Debentures,$20.36,-0.05,-0.245%,4203382775.00,United States,2021,19157,Utilities,Electric Utilities: Central
DTI,Drilling Tools International Corporation Common Stock,$4.60,-0.08,-1.709%,136935413.00,United States,2021,68424,Industrials,Metal Fabrications
DTIL,Precision BioSciences Inc. Common Stock,$13.53,-0.74,-5.186%,93576714.00,United States,2019,87439,Health Care,Biotechnology: Pharmaceutical Preparations
DTM,DT Midstream Inc. Common Stock ,$62.38,-0.37,-0.59%,6049584703.00,United States,2021,671354,Utilities,Oil & Gas Production
DTSS,Datasea Inc. Common Stock,$8.40,0.01,0.119%,21321602.00,China,,109554,Technology,Retail: Computer Software & Peripheral Equipment
DTST,Data Storage Corporation Common Stock,$5.74,-0.10,-1.712%,39720513.00,United States,,60265,Technology,EDP Services
DTSTW,Data Storage Corporation Warrant,$0.698,-0.0779,-10.04%,4830125.00,United States,,19726,Technology,EDP Services
DTW,DTE Energy Company 2017 Series E 5.25% Junior Subordinated Debentures due 2077,$24.68,-0.10,-0.404%,5095259670.00,United States,2017,12969,Utilities,Electric Utilities: Central
DUK^A,Duke Energy Corporation Depositary Shares each representing a 1/1000th interest in a share of 5.75% Series A Cumulative Redeemable Perpetual Preferred Stock,$25.06,-0.105,-0.417%,,United States,,38889,,
DUKB,Duke Energy Corporation 5.625% Junior Subordinated Debentures due 2078,$24.68,-0.06,-0.243%,19023626487.00,United States,2018,10752,Utilities,Power Generation
DUK,Duke Energy Corporation (Holding Company) Common Stock,$96.31,0.40,0.417%,74236850364.00,United States,,2348712,Utilities,Power Generation
DUO,Fangdd Network Group Ltd. American Depositary Shares,$0.4852,0.0573,13.391%,1794977.00,China,2019,647784,Finance,Real Estate
DUOL,Duolingo Inc. Class A Common Stock,$219.06,4.05,1.884%,9392378882.00,United States,2021,267087,Technology,Computer Software: Prepackaged Software
DUOT,Duos Technologies Group Inc. Common Stock,$3.29,0.005,0.152%,24038921.00,United States,,30025,Technology,Computer Software: Prepackaged Software
DVA,DaVita Inc. Common Stock,$133.73,0.12,0.09%,11728121000.00,United States,,383108,Health Care,Misc Health and Biotechnology Services
DVAX,Dynavax Technologies Corporation Common Stock,$12.05,0.00,0.00%,1573908003.00,United States,2004,907535,Health Care,Biotechnology: Pharmaceutical Preparations
DV,DoubleVerify Holdings Inc. Common Stock,$32.84,0.08,0.244%,5623978142.00,United States,2021,1429557,Technology,Computer Software: Prepackaged Software
DVN,Devon Energy Corporation Common Stock,$53.43,0.16,0.30%,33928050000.00,United States,1985,7183080,Energy,Oil & Gas Production
DWSN,Dawson Geophysical Company Common Stock,$1.70,-0.02,-1.163%,52380959.00,United States,,90187,Energy,Oil & Gas Production
DXC,DXC Technology Company Common Stock ,$20.87,0.41,2.004%,3816510382.00,United States,,933599,Technology,EDP Services
DX^C,Dynex Capital Inc. 6.900% Series C Fixed-to-Floating Rate Cumulative Redeemable Preferred Stock,$24.36,-0.02,-0.082%,,United States,,2358,,
DXCM,DexCom Inc. Common Stock,$139.94,1.01,0.727%,53949028015.00,United States,2005,2285596,Health Care,Medical/Dental Instruments
DX,Dynex Capital Inc. Common Stock,$12.12,-0.01,-0.082%,709557570.00,United States,,726936,Real Estate,Real Estate Investment Trusts
DXF,Dunxin Financial Holdings Limited American Depositary Shares,$0.2999,0.0267,9.773%,651319.00,China,,203617,Finance,Finance: Consumer Services
DXLG,Destination XL Group Inc. Common Stock,$3.43,0.00,0.00%,198902483.00,United States,,115036,Consumer Discretionary,Clothing/Shoe/Accessory Stores
DXPE,DXP Enterprises Inc. Common Stock,$55.92,0.19,0.341%,904803327.00,United States,,67255,Industrials,Industrial Machinery/Components
DXR,Daxor Corporation Common Stock,$9.54,-0.03,-0.313%,40031576.00,United States,,1218,Health Care,Medical/Dental Instruments
DXYN,Dixie Group Inc. (The) Common Stock,$0.529,0.009,1.731%,8215587.00,United States,,30910,Consumer Discretionary,Home Furnishings
DXYZ,Destiny Tech100 Inc. Common Stock,$99.79,40.59,68.564%,0.00,,2024,8269298,,
DYAI,Dyadic International Inc. Common Stock,$1.87,0.06,3.315%,54181576.00,United States,,9805,Health Care,Biotechnology: Biological Products (No Diagnostic Substances)
DYCQU,DT Cloud Acquisition Corporation Unit,$10.18,0.01,0.098%,0.00,United Kingdom,2024,19208,,
DY,Dycom Industries Inc. Common Stock,$142.07,-0.25,-0.176%,4133053557.00,United States,,225817,Industrials,Water Sewer Pipeline Comm & Power Line Construction
DYN,Dyne Therapeutics Inc. Common Stock,$26.90,0.46,1.74%,2204672029.00,United States,2020,757219,Health Care, Medicinal Chemicals and Botanical Products 
DYNT,Dynatronics Corporation Common Stock,$0.3975,-0.0042,-1.046%,1940744.00,United States,,34849,Health Care,Medical/Dental Instruments
DZSI,DZS Inc. Common Stock,$1.33,0.03,2.308%,41442505.00,United States,,79765,Utilities,Telecommunications Equipment
EAD,Allspring Income Opportunities Fund Common Shares,$6.57,0.03,0.459%,0.00,United States,2003,193730,Finance,Finance/Investors Services
EA,Electronic Arts Inc. Common Stock,$130.00,-0.29,-0.223%,34755559930.00,United States,,2290867,Technology,Computer Software: Prepackaged Software
EAF,GrafTech International Ltd. Common Stock,$1.47,-0.04,-2.649%,377542849.00,United States,2018,1678068,Energy,Industrial Machinery/Components
EAI,Entergy Arkansas LLC First Mortgage Bonds 4.875% Series Due September 1 2066,$22.42,0.01,0.045%,4780785916.00,United States,2016,17315,Utilities,Electric Utilities: Central
EARN,Ellington Residential Mortgage REIT Common Shares of Beneficial Interest,$6.76,-0.05,-0.734%,133980564.00,United States,2013,149246,Real Estate,Real Estate Investment Trusts
EAST,Eastside Distilling Inc. Common Stock,$0.9369,-0.0231,-2.406%,1598339.00,United States,,13720,Consumer Staples,Beverages (Production/Distribution)
EAT,Brinker International Inc. Common Stock,$48.20,2.06,4.465%,2131747377.00,United States,,1242198,Consumer Discretionary,Restaurants
EBAY,eBay Inc. Common Stock,$51.58,-0.48,-0.922%,26718440000.00,United States,1998,3975589,Consumer Discretionary,Catalog/Specialty Distribution
