Symbol,Name,Last Sale,Net Change,% Change,Market Cap,Country,IPO Year,Volume,Sector,Industry
JMIA,Jumia Technologies AG American Depositary Shares each representing two Ordinary Shares,$5.07,-0.07,-1.362%,512773123.00,,2019,494364,Consumer Discretionary,Catalog/Specialty Distribution
JMM,Nuveen Multi-Market Income Fund (MA),$6.0067,0.0017,0.028%,0.00,United States,,323,Finance,Trusts Except Educational Religious and Charitable
JMSB,John Marshall Bancorp Inc. Common Stock,$16.93,0.00,0.00%,239916825.00,United States,,46,Finance,Major Banks
JNJ,Johnson & Johnson Common Stock,$152.54,0.15,0.098%,367433352959.00,United States,,1045130,Health Care,Biotechnology: Pharmaceutical Preparations
JNPR,Juniper Networks Inc. Common Stock,$37.095,0.025,0.067%,11941153742.00,United States,1999,89317,Technology,Computer peripheral equipment
JNVR,Janover Inc. Common Stock,$1.19,0.00,0.00%,13166845.00,United States,2023,4788,Finance,Finance: Consumer Services
JOB,GEE Group Inc. Common Stock,$0.3535,0.0008,0.227%,38450753.00,United States,1968,30695,Consumer Discretionary,Diversified Commercial Services
JOBY,Joby Aviation Inc. Common Stock,$4.89,-0.03,-0.61%,3436971209.00,United States,2020,616488,Consumer Discretionary,Aerospace
JOE,St. Joe Company (The) Common Stock,$57.50,0.43,0.753%,3356392300.00,United States,,17582,Real Estate,Homebuilding
JOF,Japan Smaller Capitalization Fund Inc Common Stock,$7.90,0.02,0.254%,0.00,United States,1990,6930,Finance,Trusts Except Educational Religious and Charitable
JOUT,Johnson Outdoors Inc. Class A Common Stock,$44.86,-0.30,-0.664%,461326244.00,United States,,20096,Consumer Discretionary,Recreational Games/Products/Toys
JPC,Nuveen Preferred & Income Opportunities Fund,$7.145,0.025,0.351%,0.00,United States,2003,106004,Finance,Investment Managers
JPI,Nuveen Preferred and Income Term Fund Common Shares of Beneficial Interest,$19.10,0.06,0.315%,434953203.00,,2012,5195,Finance,Finance Companies
JPM,JP Morgan Chase & Co. Common Stock,$198.03,0.58,0.294%,570399967749.00,United States,,1612021,Finance,Major Banks
JPM^C,J P Morgan Chase & Co Depositary Shares each representing a 1/400th interest in a share of 6.00% Non-Cumulative  Preferred Stock Series EE,$25.29,-0.01,-0.04%,,United States,,4057,,
JPM^D,J P Morgan Chase & Co Depositary Shares each representing a 1/400th  interest in a share of 5.75% Non-Cumulative  Preferred Stock Series DD,$25.26,0.05,0.198%,,United States,,1127,,
JPM^J,J P Morgan Chase & Co Depositary Shares each representing a 1/400th interest in a share of JPMorgan Chase & Co. 4.75% Non-Cumulative Preferred Stock Series GG,$22.53,-0.09,-0.398%,,United States,,12906,,
JPM^K,J P Morgan Chase & Co Depositary Shares each representing a 1/400th interest in a share of 4.55% Non-Cumulative Preferred Stock Series JJ,$21.41,-0.07,-0.326%,,United States,,12359,,
JPM^L,J P Morgan Chase & Co Depositary Shares each representing a 1/400th interest in a share of 4.625% Non-Cumulative Preferred Stock Series LL,$21.77,-0.07,-0.321%,,United States,,11957,,
JPM^M,J P Morgan Chase & Co Depositary Shares each representing a 1/400th interest in a share of 4.20% Non-Cumulative Preferred Stock Series MM,$20.054,-0.046,-0.229%,,United States,,23153,,
JQC,Nuveen Credit Strategies Income Fund Shares of Beneficial Interest,$5.565,-0.015,-0.269%,0.00,United States,2003,76367,Finance,Finance Companies
JRI,Nuveen Real Asset Income and Growth Fund Common Shares of Beneficial Interest,$11.5821,0.0521,0.452%,0.00,United States,2012,5334,Finance,Finance Companies
JRS,Nuveen Real Estate Income Fund Common Shares of Beneficial Interest,$7.56,0.11,1.477%,0.00,United States,2001,19529,Finance,Finance/Investors Services
JRSH,Jerash Holdings (US) Inc. Common Stock,$3.14,0.00,0.00%,38605798.00,United States,2018,166,Consumer Discretionary,Apparel
JRVR,James River Group Holdings Ltd. Common Shares,$8.775,0.145,1.68%,330467228.00,Bermuda,2014,106714,Finance,Property-Casualty Insurers
JSM,Navient Corporation 6% Senior Notes due December 15 2043,$20.80,0.00,0.00%,2345197587.00,United States,,79,Finance,Finance: Consumer Services
JSPR,Jasper Therapeutics Inc. Common Stock,$30.16,0.66,2.237%,454327103.00,United States,2020,15466,Health Care,Biotechnology: Biological Products (No Diagnostic Substances)
JSPRW,Japer Therapeutics Inc. Warrants,$0.175,0.009,5.422%,2636182.00,United States,2020,2411,Health Care,Biotechnology: Biological Products (No Diagnostic Substances)
JTAI,Jet.AI Inc. Common Stock,$0.8251,-0.013,-1.551%,10070464.00,Cayman Islands,2021,58555,Finance,Blank Checks
JTAIW,Jet.AI Inc. Warrant,$0.08,0.0225,39.13%,0.00,Cayman Islands,2021,10200,Finance,Blank Checks
JTAIZ,Jet.AI Inc. Merger Consideration Warrants,$0.41,0.00,0.00%,5004109.00,Cayman Islands,,98,,
JVA,Coffee Holding Co. Inc. Common Stock,$1.49,-0.01,-0.667%,8505813.00,United States,2005,8536,Consumer Staples,Packaged Foods
JVSA,JV SPAC Acquisition Corp. Class A Ordinary Share,$10.07,0.01,0.099%,0.00,China,2024,2988,,
JVSAR,JV SPAC Acquisition Corp. Right,$0.35,0.09,34.615%,0.00,China,2024,32500,,
JVSAU,JVSPAC Acquisition Corp. Unit,$10.50,0.20,1.942%,0.00,China,2024,9018,,
JWEL,Jowell Global Ltd. Ordinary Shares,$1.3999,-0.0401,-2.785%,2985686.00,China,2021,441,Consumer Discretionary,Other Consumer Services
JWN,Nordstrom Inc. Common Stock,$18.835,0.175,0.938%,3074968536.00,United States,,353770,Consumer Discretionary,Clothing/Shoe/Accessory Stores
JWSM,Jaws Mustang Acquisition Corp. Class A Ordinary Shares,$11.0098,0.0094,0.085%,0.00,,2021,348,Finance,Blank Checks
JXJT,JX Luxventure Limited Common Stock,$1.26,0.02,1.613%,7635600.00,China,2013,12101,Consumer Staples,Apparel
JXN,Jackson Financial Inc. Class A Common Stock ,$66.25,-0.29,-0.436%,5128562954.00,United States,2021,30790,Finance,Life Insurance
JXN^A,Jackson Financial Inc. Depositary Shares each representing a 1/1000th interest in a share of Fixed-Rate Reset Noncumulative Perpetual Preferred Stock Series A,$26.3223,-0.0727,-0.275%,,United States,,814,,
JYD,Jayud Global Logistics Limited Class A Ordinary Shares,$0.94,0.0185,2.008%,20151250.00,China,2023,612,Consumer Discretionary,Oil Refining/Marketing
JYNT,The Joint Corp. Common Stock,$12.79,0.05,0.392%,188988148.00,United States,2014,21993,Miscellaneous,Multi-Sector Companies
JZ,Jianzhi Education Technology Group Company Limited American Depositary Shs,$2.2476,0.0626,2.865%,45367806.00,China,2022,792,Real Estate,Other Consumer Services
JZXN,Jiuzi Holdings Inc. Ordinary Shares,$0.6435,0.0235,3.79%,1663316.00,China,2021,420806,Consumer Discretionary,Retail-Auto Dealers and Gas Stations
K,Kellanova Common Stock,$57.52,0.07,0.122%,19595813803.00,United States,,345513,Consumer Staples,Packaged Foods
KA,Kineta Inc. Common Stock,$0.571,0.0111,1.982%,6259565.00,United States,2016,2157,Health Care,Biotechnology: Pharmaceutical Preparations
KACL,Kairous Acquisition Corp. Limited Ordinary Shares,$11.6601,0.00,0.00%,0.00,Malaysia,2022,2,Finance,Blank Checks
KAI,Kadant Inc Common Stock,$301.76,2.06,0.687%,3536267502.00,United States,1992,2606,Industrials,Industrial Machinery/Components
KALA,KALA BIO Inc. Common Stock,$7.7036,0.1036,1.363%,21696835.00,United States,2017,841,Health Care,Biotechnology: Pharmaceutical Preparations
KALU,Kaiser Aluminum Corporation Common Stock,$92.82,-0.15,-0.161%,1486585721.00,United States,,10145,Industrials,Metal Fabrications
KALV,KalVista Pharmaceuticals Inc. Common Stock,$10.89,-0.20,-1.803%,459430543.00,United Kingdom,2015,20825,Health Care,Biotechnology: Pharmaceutical Preparations
KAMN,Kaman Corporation Common Stock,$45.855,0.005,0.011%,1298573981.00,United States,,25539,Industrials,Military/Government/Technical
KAR,OPENLANE Inc. Common Stock,$17.22,0.09,0.525%,1860544526.00,United States,2009,28049,Consumer Discretionary,Retail-Auto Dealers and Gas Stations
KARO,Karooooo Ltd. Ordinary Shares,$26.24,-0.06,-0.228%,812157021.00,Singapore,2021,267,Technology,Computer Software: Prepackaged Software
KAVL,Kaival Brands Innovations Group Inc. Common Stock,$2.68,-0.03,-1.107%,7672845.00,United States,,10723,Health Care, Medicinal Chemicals and Botanical Products 
KB,KB Financial Group Inc,$51.35,0.19,0.371%,20007723102.00,South Korea,,9250,Finance,Commercial Banks
KBH,KB Home Common Stock,$66.62,-0.74,-1.099%,5054261405.00,United States,1986,72592,Consumer Discretionary,Homebuilding
KBR,KBR Inc. Common Stock,$64.54,-0.39,-0.601%,8717517256.00,United States,2006,104287,Industrials,Military/Government/Technical
KC,Kingsoft Cloud Holdings Limited American Depositary Shares,$3.04,-0.04,-1.299%,771204385.00,China,2020,139565,Technology,Computer Software: Prepackaged Software
KCGI,Kensington Capital Acquisition Corp. V Class A Ordinary Shares,$10.8501,0.00,0.00%,0.00,,2021,2,Finance,Blank Checks
KD,Kyndryl Holdings Inc. Common Stock,$21.985,-0.005,-0.023%,5058822106.00,United States,2021,119018,Technology,EDP Services
KDP,Keurig Dr Pepper Inc. Common Stock,$30.89,0.12,0.39%,42862686299.00,United States,,580162,Consumer Staples,Beverages (Production/Distribution)
KE,Kimball Electronics Inc. Common Stock,$21.27,0.15,0.71%,528968012.00,United States,,65484,Technology,Electrical Products
KELYA,Kelly Services Inc. Class A Common Stock,$24.51,0.16,0.657%,864923807.00,United States,,8602,Consumer Discretionary,Professional Services
KELYB,Kelly Services Inc. Class B Common Stock,$24.5307,0.00,0.00%,865654281.00,United States,,4,Consumer Discretionary,Professional Services
KEN,Kenon Holdings Ltd. Ordinary Shares,$21.6904,-1.0996,-4.825%,1144512284.00,Singapore,2015,30145,Utilities,Electric Utilities: Central
KEP,Korea Electric Power Corporation Common Stock,$8.275,0.155,1.909%,10624505474.00,South Korea,1994,18335,Utilities,Electric Utilities: Central
KEQU,Kewaunee Scientific Corporation Common Stock,$34.50,-1.60,-4.432%,99191088.00,United States,,5068,Industrials,Medical Specialities
KEX,Kirby Corporation Common Stock,$98.88,0.04,0.04%,5786655360.00,United States,,40780,Consumer Discretionary,Marine Transportation
KEY,KeyCorp Common Stock,$15.31,0.25,1.66%,14297116305.00,United States,,1280793,Finance,Major Banks
KEY^I,KeyCorp Depositary Shares Each Representing a 1/40th Ownership Interest in a Share of Fixed-to-Floating Rate Perpetual Non-Cumulative Preferred Stock Series E,$23.81,-0.08,-0.335%,,United States,,1429,,
KEY^J,KeyCorp Depositary Shares each representing a 1/40th ownership interest in a share of Fixed Rate Perpetual Non-Cumulative Preferred Stock Series F,$21.55,0.08,0.373%,,United States,,3367,,
KEY^K,KeyCorp Depositary Shares each representing a 1/40th ownership interest in a share of Fixed Rate Perpetual Non-Cumulative Preferred Stock Series G,$21.8199,0.1199,0.553%,,United States,,2025,,
KEY^L,KeyCorp Depositary Shares each representing a 1/40th ownership interest in a share of Fixed Rate Perpetual Non-Cumulative Preferred Stock Series H,$22.95,0.40,1.774%,,United States,,4755,,
KEYS,Keysight Technologies Inc. Common Stock,$158.51,1.28,0.814%,27668846515.00,United States,2014,160194,Industrials,Industrial Machinery/Components
KF,Korea Fund Inc. (The) New Common Stock,$25.0825,0.1525,0.612%,0.00,United States,,2496,Finance,Investment Managers
KFFB,Kentucky First Federal Bancorp Common Stock,$3.80,0.00,0.00%,30729517.00,United States,2005,28,Finance,Savings Institutions
KFRC,Kforce Inc. Common Stock,$68.89,0.47,0.687%,1344595020.00,United States,1995,905,Consumer Discretionary,Professional Services
KFS,Kingsway Financial Services Inc. Common Stock (DE),$8.165,-0.095,-1.15%,229610178.00,Canada,,2322,Finance,Property-Casualty Insurers
KFY,Korn Ferry Common Stock,$64.115,0.545,0.857%,3345536023.00,United States,1999,6717,Consumer Discretionary,Diversified Commercial Services
KGC,Kinross Gold Corporation Common Stock,$6.365,-0.035,-0.547%,7815583500.00,Canada,2001,6060527,,
KGEI,Kolibri Global Energy Inc. Common stock,$3.45,0.09,2.679%,122908275.00,United States,,14429,Energy,Oil & Gas Production
KGS,Kodiak Gas Services Inc. Common Stock,$27.66,-0.46,-1.636%,2141840400.00,United States,2023,39724,,
KHC,The Kraft Heinz Company Common Stock,$36.881,-0.179,-0.483%,44740333244.00,United States,,758079,Consumer Staples,Packaged Foods
KIDS,OrthoPediatrics Corp. Common Stock,$27.64,0.17,0.619%,650908069.00,United States,2017,34422,Health Care,Medical/Dental Instruments
KIM,Kimco Realty Corporation (HC) Common Stock,$18.73,0.22,1.189%,12603500910.00,United States,,213218,Real Estate,Real Estate Investment Trusts
KIM^L,Kimco Realty Corporation Class L Depositary Shares each of which represents a one-one thousandth fractional interest in a share of 5.125% Class L Cumulative Redeemable Preferred Stock liquidation preference $25000.00 per share,$22.50,0.05,0.223%,,United States,,510,,
KIM^M,Kimco Realty Corporation Class M Depositary Shares each of which represents a one-one thousandth fractional interest in a share of 5.25% Class M Cumulative Redeemable Preferred Stock liquidation preference $25000.00 per share,$22.64,-0.09,-0.396%,,United States,,884,,
KIM^N,Kimco Realty Corporation Depositary Shares each representing 1/1000th interest in a share of 7.25% Class N Cumulative Convertible Perpetual Preferred Stock,$55.68,0.03,0.054%,,United States,,1423,,
KIND,Nextdoor Holdings Inc. Class A Common Stock,$2.14,0.06,2.885%,842370113.00,United States,,73335,Technology,Computer Software: Programming Data Processing
KINS,Kingstone Companies Inc. Common Stock,$4.17,-0.16,-3.695%,45902626.00,United States,,5243,Finance,Property-Casualty Insurers
KIO,KKR Income Opportunities Fund Common Shares,$13.4683,0.0683,0.51%,0.00,,2013,22083,Finance,Investment Managers
KIRK,Kirkland's Inc. COMMONSTOCK,$2.2939,0.0239,1.053%,29651002.00,United States,2002,1592,Consumer Discretionary,Other Specialty Stores
KITT,Nauticus Robotics Inc. Common stock,$0.2681,0.0003,0.112%,13414604.00,United States,2021,87986,Industrials,Industrial Machinery/Components
KITTW,Nauticus Robotics Inc. Warrant,$0.0287,-0.0009,-3.041%,1436028.00,United States,2021,5934,Industrials,Industrial Machinery/Components
KKR,KKR & Co. Inc. Common Stock,$101.1525,0.2225,0.22%,89520840099.00,United States,,269307,Finance,Investment Managers
KKRS,KKR Group Finance Co. IX LLC 4.625% Subordinated Notes due 2061,$19.62,0.04,0.204%,17363870223.00,United States,2021,1186,,
KLAC,KLA Corporation Common Stock,$683.62,0.78,0.114%,92448428497.00,United States,1980,92309,Technology,Electronic Components
KLG,WK Kellogg Co Common Stock,$20.525,0.395,1.962%,1761405850.00,United States,2023,224020,Consumer Staples,Packaged Foods
KLIC,Kulicke and Soffa Industries Inc. Common Stock,$48.78,0.60,1.245%,2748319199.00,Singapore,,27642,Technology,Semiconductors
KLTR,Kaltura Inc. Common Stock,$1.34,-0.01,-0.741%,191965890.00,United States,2021,2241,Technology,EDP Services
KLXE,KLX Energy Services Holdings Inc. Common Stock,$7.60,-0.01,-0.131%,127089617.00,United States,,31208,Energy,Oilfield Services/Equipment
KMB,Kimberly-Clark Corporation Common Stock,$126.36,0.05,0.04%,42568560899.00,United States,,100755,Consumer Discretionary,Containers/Packaging
KMDA,Kamada Ltd. Ordinary Shares,$5.53,0.15,2.788%,247965200.00,Israel,2013,1898,Health Care,Biotechnology: Pharmaceutical Preparations
KMI,Kinder Morgan Inc. Common Stock,$18.465,0.005,0.027%,40980666496.00,United States,2011,1092845,Utilities,Natural Gas Distribution
KMPB,Kemper Corporation 5.875% Fixed-Rate Reset Junior Subordinated Debentures due 2062,$23.17,0.05,0.216%,1490379967.00,United States,2022,231,Finance,Property-Casualty Insurers
KMPR,Kemper Corporation,$58.29,0.13,0.224%,3749428065.00,United States,,9746,Finance,Property-Casualty Insurers
KMT,Kennametal Inc. Common Stock,$24.33,0.16,0.662%,1928633796.00,United States,,21251,Industrials,Industrial Machinery/Components
KMX,CarMax Inc,$82.94,1.45,1.779%,13097985074.00,United States,,154954,Consumer Discretionary,Other Specialty Stores
KN,Knowles Corporation Common Stock,$15.98,0.06,0.377%,1432285243.00,United States,2014,43594,Consumer Staples,Consumer Electronics/Appliances
KNDI,Kandi Technologies Group Inc Common Stock,$2.04,-0.01,-0.488%,178210797.00,China,,29819,Consumer Discretionary,Auto Manufacturing
KNF,Knife Riv Holding Co. Common Stock,$80.00,-0.77,-0.953%,4526272480.00,United States,2023,17206,,
KNOP,KNOT Offshore Partners LP Common Units representing Limited Partner Interests,$5.22,0.02,0.385%,177741000.00,United Kingdom,2013,10416,Consumer Discretionary,Marine Transportation
KNSA,Kiniksa Pharmaceuticals Ltd. Class A Common Stock,$17.75,-0.15,-0.838%,1253416641.00,United States,2018,19323,Health Care,Biotechnology: Pharmaceutical Preparations
KNSL,Kinsale Capital Group Inc. Common Stock,$457.33,9.19,2.051%,10605068816.00,United States,,15470,Finance,Property-Casualty Insurers
KNTK,Kinetik Holdings Inc. Class A Common Stock,$39.40,0.02,0.051%,5957522468.00,United States,2022,38846,Utilities,Natural Gas Distribution
KNW,Know Labs Inc. Common Stock,$0.6595,0.0197,3.079%,53648033.00,,2022,29343,Industrials,Industrial Machinery/Components
KNX,Knight-Swift Transportation Holdings Inc.,$53.25,0.08,0.15%,8592899250.00,United States,2017,160616,Industrials,Trucking Freight/Courier Services
KO,Coca-Cola Company (The) Common Stock,$59.295,-0.215,-0.361%,255707088482.00,United States,,1381343,Consumer Staples,Beverages (Production/Distribution)
KOD,Kodiak Sciences Inc Common Stock,$4.045,-0.075,-1.82%,212397295.00,United States,2018,62762,Health Care,Biotechnology: Biological Products (No Diagnostic Substances)
KODK,Eastman Kodak Company Common New,$5.14,0.03,0.587%,410686000.00,United States,,145412,Consumer Discretionary,Business Services
KOF,Coca Cola Femsa S.A.B. de C.V.  American Depositary Shares each representing 10 Units (each Unit consists of 3 Series B Shares and 5 Series L Shares),$95.90,0.41,0.429%,20146981373.00,Mexico,1993,3349,Consumer Staples,Beverages (Production/Distribution)
KOP,Koppers Holdings Inc. Common Stock,$56.10,0.04,0.071%,1179670239.00,United States,2006,5591,Basic Materials,Forest Products
KOPN,Kopin Corporation Common Stock,$1.65,0.01,0.61%,195406205.00,United States,1992,186107,Technology,Semiconductors
KORE,KORE Group Holdings Inc. Common Stock,$0.70,-0.01,-1.408%,60697407.00,United States,,1120,Consumer Discretionary,Telecommunications Equipment
KOS,Kosmos Energy Ltd. Common Shares (DE),$6.01,0.14,2.385%,2833730283.00,Bermuda,2011,2490613,Energy,Oil & Gas Production
KOSS,Koss Corporation Common Stock,$2.5446,0.0546,2.193%,23549751.00,United States,,2244,Consumer Staples,Consumer Electronics/Appliances
KPLT,Katapult Holdings Inc. Common Stock,$10.20,0.02,0.196%,41464785.00,United States,2019,442,Consumer Discretionary,Diversified Commercial Services
KPLTW,Katapult Holdings Inc. Warrant,$0.0152,-0.0005,-3.185%,61791.00,United States,2019,2412,Consumer Discretionary,Diversified Commercial Services
KPRX,Kiora Pharmaceuticals Inc.  Common Stock,$0.6002,0.0022,0.368%,15758969.00,United States,,108221,Health Care,Biotechnology: Pharmaceutical Preparations
KPTI,Karyopharm Therapeutics Inc. Common Stock,$1.37,0.01,0.735%,157641904.00,United States,2013,91216,Health Care,Biotechnology: Pharmaceutical Preparations
KR,Kroger Company (The) Common Stock,$56.515,-0.795,-1.387%,40786188504.00,United States,,885325,Consumer Staples,Food Chains
KRC,Kilroy Realty Corporation Common Stock,$34.49,0.35,1.025%,4046587881.00,United States,1997,59787,Real Estate,Real Estate Investment Trusts
KREF,KKR Real Estate Finance Trust Inc. Common Stock,$9.7242,-0.0358,-0.367%,674021837.00,United States,2017,55842,Real Estate,Real Estate Investment Trusts
KREF^A,KKR Real Estate Finance Trust Inc. 6.50% Series A Cumulative Redeemable Preferred Stock,$18.77,0.41,2.233%,,United States,,1462,,
KRG,Kite Realty Group Trust Common Stock,$20.465,0.125,0.615%,4491012099.00,United States,2004,85371,Real Estate,Real Estate Investment Trusts
KRKR,36Kr Holdings Inc. American Depositary Shares,$0.38,0.0149,4.081%,14811921.00,China,2019,1419,Consumer Discretionary,Business Services
KRMD,KORU Medical Systems Inc. Common Stock (DE),$2.47,-0.02,-0.803%,112904935.00,United States,,787,Health Care,Medical/Dental Instruments
KRNL,Kernel Group Holdings Inc. Class A Ordinary Shares,$10.8299,0.0399,0.37%,0.00,United States,2021,483,Finance,Blank Checks
KRNLU,Kernel Group Holdings Inc. Units,$10.90,0.00,0.00%,0.00,United States,2021,8,Finance,Blank Checks
KRNLW,Kernel Group Holdings Inc. Warrants,$0.0401,0.0001,0.25%,0.00,United States,2021,161481,Finance,Blank Checks
KRNT,Kornit Digital Ltd. Ordinary Shares,$16.605,-0.025,-0.15%,792384506.00,Israel,2015,16662,Industrials,Industrial Machinery/Components
KRNY,Kearny Financial Corp Common Stock,$6.125,-0.035,-0.568%,394676594.00,United States,2005,68007,Finance,Savings Institutions
KRO,Kronos Worldwide Inc Common Stock,$12.19,0.08,0.661%,1402179325.00,United States,,34849,Industrials,Major Chemicals
KRON,Kronos Bio Inc. Common Stock,$1.164,-0.066,-5.366%,69950595.00,United States,2020,100555,Health Care, Medicinal Chemicals and Botanical Products 
KROS,Keros Therapeutics Inc. Common Stock,$61.695,-0.965,-1.54%,2219948234.00,United States,2020,15847,Health Care,Biotechnology: Pharmaceutical Preparations
KRP,Kimbell Royalty Partners Common Units Representing Limited Partner Interests,$16.10,-0.04,-0.248%,1524649923.00,United States,2017,21425,Energy,Oil & Gas Production
KRRO,Korro Bio Inc. Common Stock,$68.00,0.37,0.547%,545492328.00,United States,2019,1769,Health Care,Biotechnology: Pharmaceutical Preparations
KRT,Karat Packaging Inc. Common Stock,$28.59,-0.28,-0.97%,571000338.00,United States,2021,6299,Industrials,Plastic Products
KRUS,Kura Sushi USA Inc. Class A Common Stock,$111.28,1.23,1.118%,1249753743.00,United States,2019,24951,Consumer Discretionary,Restaurants
KRYS,Krystal Biotech Inc. Common Stock,$179.50,-0.52,-0.289%,5078524572.00,United States,2017,36591,Health Care,Biotechnology: Biological Products (No Diagnostic Substances)
KSCP,Knightscope Inc. Class A Common Stock,$0.565,0.0102,1.839%,58007466.00,United States,2022,230847,Telecommunications,Telecommunications Equipment
KSM,DWS Strategic Municipal Income Trust,$9.545,0.005,0.052%,0.00,United States,1989,1337,Finance,Trusts Except Educational Religious and Charitable
KSPI,Joint Stock Company Kaspi.kz American Depository Shares,$128.445,-4.315,-3.25%,24318936912.00,Kazakhstan,2024,62931,,
KSS,Kohl's Corporation Common Stock,$25.37,-0.13,-0.51%,2813704932.00,United States,1992,956745,Consumer Discretionary,Department/Specialty Retail Stores
KT,KT Corporation Common Stock,$13.565,0.145,1.08%,6946437854.00,South Korea,,47628,Telecommunications,Telecommunications Equipment
KTB,Kontoor Brands Inc. Common Stock ,$56.66,0.28,0.497%,3159340749.00,United States,2019,21073,Consumer Discretionary,Apparel
KTCC,Key Tronic Corporation Common Stock,$4.73,0.05,1.068%,50903650.00,United States,1983,2881,Technology,Electrical Products
KTF,DWS Municipal Income Trust,$9.61,0.05,0.523%,379604014.00,United States,1988,10422,Finance,Finance Companies
KTH,Structures Products Cp 8% CorTS Issued by Peco Energy Cap Tr II Preferred Stock,$28.92,-0.02,-0.069%,0.00,United States,,4969,Finance,Investment Managers
KTN,Structured Products Corp 8.205% CorTS 8.205% Corporate Backed Trust Securities (CorTS),$26.72,0.00,0.00%,0.00,United States,,3,Finance,Finance: Consumer Services
KTOS,Kratos Defense & Security Solutions Inc. Common Stock,$18.18,0.38,2.135%,2363353477.00,United States,,208807,Industrials,Military/Government/Technical
KTRA,Kintara Therapeutics Inc. Common Stock,$0.1206,-0.0095,-7.302%,4707971.00,United States,,1619937,Health Care,Biotechnology: Pharmaceutical Preparations
KTTA,Pasithea Therapeutics Corp. Common Stock,$8.50,0.00,0.00%,8860528.00,United States,2021,241,Health Care,Biotechnology: Pharmaceutical Preparations
KUKE,Kuke Music Holding Limited American Depositary Shares each representing one Ordinary Share,$2.03,-0.07,-3.333%,44224819.00,,2021,1146,Real Estate,Other Consumer Services
KULR,KULR Technology Group Inc. Common Stock,$0.71,0.1245,21.264%,90798119.00,United States,,16877285,Technology,Electrical Products
KURA,Kura Oncology Inc. Common Stock,$20.37,0.01,0.049%,1550909936.00,United States,,35083,Health Care,Biotechnology: Pharmaceutical Preparations
KVAC,Keen Vision Acquisition Corporation Ordinary Shares,$10.50,0.0399,0.381%,0.00,United States,2023,1000,,
KVACU,Keen Vision Acquisition Corporation Units,$10.59,0.00,0.00%,0.00,United States,2023,1100,,
KVACW,Keen Vision Acquisition Corporation Warrant,$0.0685,0.0058,9.25%,0.00,United States,2023,3200,,
KVHI,KVH Industries Inc. Common Stock,$5.10,0.04,0.791%,100194325.00,United States,1996,7022,Technology,Radio And Television Broadcasting And Communications Equipment
KVUE,Kenvue Inc. Common Stock,$20.125,-0.125,-0.617%,38530959751.00,United States,2023,968924,Consumer Discretionary,Specialty Chemicals
KVYO,Klaviyo Inc. Series A Common Stock,$24.15,-0.03,-0.124%,6308813875.00,United States,2023,131467,,
KW,Kennedy-Wilson Holdings Inc. Common Stock,$8.35,0.11,1.335%,1160463778.00,United States,,90376,Finance,Real Estate
KWE,KWESST Micro Systems Inc. Common Stock,$0.782,-0.0281,-3.469%,4693953.00,Canada,,28087,Technology,Computer Software: Prepackaged Software
KWESW,KWESST Micro Systems Inc. Warrant,$0.1398,0.0198,16.50%,2398778.00,Canada,,802,Technology,Computer Software: Prepackaged Software
KWR,Quaker Houghton Common Stock,$197.92,1.32,0.671%,3560932702.00,United States,,1259,Industrials,Major Chemicals
KXIN,Kaixin Auto Holdings Ordinary Shares,$0.1901,0.0126,7.099%,5032717.00,China,2017,173058,Consumer Discretionary,Retail-Auto Dealers and Gas Stations
KYMR,Kymera Therapeutics Inc. Common Stock,$36.00,-0.40,-1.099%,2200020408.00,United States,2020,19455,Health Care, Medicinal Chemicals and Botanical Products 
KYN,Kayne Anderson Energy Infrastructure Fund Inc.,$9.715,-0.005,-0.051%,1322517814.00,United States,2004,114284,Finance,Finance/Investors Services
KYTX,Kyverna Therapeutics Inc. Common Stock,$22.89,0.67,3.015%,986907935.00,United States,2024,28573,,
