JRSH,Jerash Holdings (US) Inc. Common Stock,$3.04,-0.10,-3.185%,37376314.00,United States,2018,24502,Consumer Discretionary,Apparel
JRS,Nuveen Real Estate Income Fund Common Shares of Beneficial Interest,$7.55,0.10,1.342%,0.00,United States,2001,71601,Finance,Finance/Investors Services
JRVR,James River Group Holdings Ltd. Common Shares,$8.82,0.19,2.202%,332161932.00,Bermuda,2014,510221,Finance,Property-Casualty Insurers
JSM,Navient Corporation 6% Senior Notes due December 15 2043,$20.33,-0.47,-2.26%,2292205142.00,United States,,11378,Finance,Finance: Consumer Services
JSPR,Jasper Therapeutics Inc. Common Stock,$30.00,0.50,1.695%,451916880.00,United States,2020,66023,Health Care,Biotechnology: Biological Products (No Diagnostic Substances)
JSPRW,Japer Therapeutics Inc. Warrants,$0.1699,0.0039,2.349%,2559356.00,United States,2020,59607,Health Care,Biotechnology: Biological Products (No Diagnostic Substances)
JTAI,Jet.AI Inc. Common Stock,$0.841,0.0029,0.346%,10264526.00,Cayman Islands,2021,90840,Finance,Blank Checks
JTAIW,Jet.AI Inc. Warrant,$0.0742,0.0167,29.043%,0.00,Cayman Islands,2021,11171,Finance,Blank Checks
JTAIZ,Jet.AI Inc. Merger Consideration Warrants,$0.40,-0.01,-2.439%,4882058.00,Cayman Islands,,463,,
JVA,Coffee Holding Co. Inc. Common Stock,$1.485,-0.015,-1.00%,8477270.00,United States,2005,60612,Consumer Staples,Packaged Foods
JVSA,JV SPAC Acquisition Corp. Class A Ordinary Share,$10.07,0.01,0.099%,0.00,China,2024,33479,,
JVSAR,JV SPAC Acquisition Corp. Right,$0.40,0.14,53.846%,0.00,China,2024,72300,,
JVSAU,JVSPAC Acquisition Corp. Unit,$10.45,0.15,1.456%,0.00,China,2024,19686,,
JWEL,Jowell Global Ltd. Ordinary Shares,$1.32,-0.12,-8.333%,2815276.00,China,2021,1949,Consumer Discretionary,Other Consumer Services
JWN,Nordstrom Inc. Common Stock,$19.44,0.78,4.18%,3173739758.00,United States,,3343041,Consumer Discretionary,Clothing/Shoe/Accessory Stores
JWSM,Jaws Mustang Acquisition Corp. Class A Ordinary Shares,$11.0098,0.0094,0.085%,0.00,,2021,352,Finance,Blank Checks
JXJT,JX Luxventure Limited Common Stock,$1.28,0.04,3.226%,7756800.00,China,2013,22613,Consumer Staples,Apparel
JXN^A,Jackson Financial Inc. Depositary Shares each representing a 1/1000th interest in a share of Fixed-Rate Reset Noncumulative Perpetual Preferred Stock Series A,$26.22,-0.175,-0.663%,,United States,,16758,,
JXN,Jackson Financial Inc. Class A Common Stock ,$66.26,-0.28,-0.421%,5129337076.00,United States,2021,451780,Finance,Life Insurance
JYD,Jayud Global Logistics Limited Class A Ordinary Shares,$0.98,0.0585,6.348%,21008750.00,China,2023,3497,Consumer Discretionary,Oil Refining/Marketing
JYNT,The Joint Corp. Common Stock,$12.91,0.17,1.334%,190761297.00,United States,2014,54967,Miscellaneous,Multi-Sector Companies
JZ,Jianzhi Education Technology Group Company Limited American Depositary Shs,$2.25,0.065,2.975%,45416250.00,China,2022,6074,Real Estate,Other Consumer Services
JZXN,Jiuzi Holdings Inc. Ordinary Shares,$0.56,-0.06,-9.677%,1447485.00,China,2021,1647957,Consumer Discretionary,Retail-Auto Dealers and Gas Stations
KACL,Kairous Acquisition Corp. Limited Ordinary Shares,$11.67,0.0099,0.085%,0.00,Malaysia,2022,343,Finance,Blank Checks
KACLR,Kairous Acquisition Corp. Limited Rights,$0.10,0.00,0.00%,0.00,Malaysia,2022,8,Finance,Blank Checks
KAI,Kadant Inc Common Stock,$305.86,6.16,2.055%,3584314615.00,United States,1992,57738,Industrials,Industrial Machinery/Components
KA,Kineta Inc. Common Stock,$0.54,-0.0199,-3.554%,5919728.00,United States,2016,5489132,Health Care,Biotechnology: Pharmaceutical Preparations
KALA,KALA BIO Inc. Common Stock,$7.62,0.02,0.263%,21461379.00,United States,2017,5619,Health Care,Biotechnology: Pharmaceutical Preparations
KALU,Kaiser Aluminum Corporation Common Stock,$93.76,0.79,0.85%,1501640564.00,United States,,113748,Industrials,Metal Fabrications
KALV,KalVista Pharmaceuticals Inc. Common Stock,$11.04,-0.05,-0.451%,465758788.00,United Kingdom,2015,210204,Health Care,Biotechnology: Pharmaceutical Preparations
KAMN,Kaman Corporation Common Stock,$45.86,0.01,0.022%,1298715577.00,United States,,176762,Industrials,Military/Government/Technical
KARO,Karooooo Ltd. Ordinary Shares,$26.40,0.10,0.38%,817109198.00,Singapore,2021,4379,Technology,Computer Software: Prepackaged Software
KAR,OPENLANE Inc. Common Stock,$17.28,0.15,0.876%,1867027260.00,United States,2009,706757,Consumer Discretionary,Retail-Auto Dealers and Gas Stations
KAVL,Kaival Brands Innovations Group Inc. Common Stock,$2.61,-0.10,-3.69%,7472435.00,United States,,70069,Health Care, Medicinal Chemicals and Botanical Products 
KBH,KB Home Common Stock,$66.45,-0.91,-1.351%,5044565372.00,United States,1986,789839,Consumer Discretionary,Homebuilding
KB,KB Financial Group Inc,$51.47,0.31,0.606%,20054479222.00,South Korea,,129810,Finance,Commercial Banks
KBR,KBR Inc. Common Stock,$64.34,-0.59,-0.909%,8690502948.00,United States,2006,1084669,Industrials,Military/Government/Technical
KCGI,Kensington Capital Acquisition Corp. V Class A Ordinary Shares,$10.88,0.0299,0.276%,0.00,,2021,537,Finance,Blank Checks
KC,Kingsoft Cloud Holdings Limited American Depositary Shares,$2.97,-0.11,-3.571%,753446389.00,China,2020,710720,Technology,Computer Software: Prepackaged Software
KD,Kyndryl Holdings Inc. Common Stock,$21.86,-0.13,-0.591%,5030059187.00,United States,2021,1433178,Technology,EDP Services
KDP,Keurig Dr Pepper Inc. Common Stock,$30.80,0.03,0.097%,42737803108.00,United States,,6350683,Consumer Staples,Beverages (Production/Distribution)
KE,Kimball Electronics Inc. Common Stock,$21.47,0.35,1.657%,533941853.00,United States,,189713,Technology,Industrial Machinery/Components
KELYA,Kelly Services Inc. Class A Common Stock,$24.58,0.23,0.945%,867394009.00,United States,,198711,Consumer Discretionary,Professional Services
KELYB,Kelly Services Inc. Class B Common Stock,$24.5307,0.00,0.00%,865654281.00,United States,,135,Consumer Discretionary,Professional Services
KEN,Kenon Holdings Ltd. Ordinary Shares,$21.87,-0.92,-4.037%,1153989030.00,Singapore,2015,53008,Utilities,Electric Utilities: Central
KEP,Korea Electric Power Corporation Common Stock,$8.24,0.12,1.478%,10579567989.00,South Korea,1994,592144,Industrials,Electrical Products
KEQU,Kewaunee Scientific Corporation Common Stock,$34.92,-1.18,-3.269%,100398632.00,United States,,13874,Industrials,Medical Specialities
KEX,Kirby Corporation Common Stock,$99.55,0.71,0.718%,5825865100.00,United States,,583510,Consumer Discretionary,Marine Transportation
KEY^I,KeyCorp Depositary Shares Each Representing a 1/40th Ownership Interest in a Share of Fixed-to-Floating Rate Perpetual Non-Cumulative Preferred Stock Series E,$23.75,-0.14,-0.586%,,United States,,19164,,
KEY^J,KeyCorp Depositary Shares each representing a 1/40th ownership interest in a share of Fixed Rate Perpetual Non-Cumulative Preferred Stock Series F,$21.5103,0.0403,0.188%,,United States,,17050,,
KEY,KeyCorp Common Stock,$15.45,0.39,2.59%,14427854141.00,United States,,8256121,Finance,Major Banks
KEY^K,KeyCorp Depositary Shares each representing a 1/40th ownership interest in a share of Fixed Rate Perpetual Non-Cumulative Preferred Stock Series G,$21.70,0.00,0.00%,,United States,,14185,,
KEY^L,KeyCorp Depositary Shares each representing a 1/40th ownership interest in a share of Fixed Rate Perpetual Non-Cumulative Preferred Stock Series H,$22.58,0.03,0.133%,,United States,,39693,,
KEYS,Keysight Technologies Inc. Common Stock,$158.75,1.52,0.967%,27710739918.00,United States,2014,1375580,Industrials,Industrial Machinery/Components
KFFB,Kentucky First Federal Bancorp Common Stock,$3.80,0.00,0.00%,30729517.00,United States,2005,1342,Finance,Savings Institutions
KF,Korea Fund Inc. (The) New Common Stock,$25.04,0.11,0.441%,0.00,United States,,4129,Finance,Investment Managers
KFRC,Kforce Inc. Common Stock,$68.39,-0.03,-0.044%,1334836020.00,United States,1995,42535,Consumer Discretionary,Professional Services
KFS,Kingsway Financial Services Inc. Common Stock (DE),$8.20,-0.06,-0.726%,230594422.00,Canada,,14539,Finance,Property-Casualty Insurers
KFY,Korn Ferry Common Stock,$64.00,0.43,0.676%,3339535296.00,United States,1999,174611,Consumer Discretionary,Diversified Commercial Services
KGC,Kinross Gold Corporation Common Stock,$6.40,0.00,0.00%,7865489286.00,Canada,2001,21104558,,
KGEI,Kolibri Global Energy Inc. Common stock,$3.54,0.18,5.357%,126114578.00,United States,,112627,,
KGS,Kodiak Gas Services Inc. Common Stock,$27.76,-0.36,-1.28%,2149583858.00,United States,2023,363004,,
KHC,The Kraft Heinz Company Common Stock,$37.05,-0.01,-0.027%,44945347108.00,United States,,4651094,Consumer Staples,Packaged Foods
KIDS,OrthoPediatrics Corp. Common Stock,$27.88,0.41,1.493%,656559948.00,United States,2017,107599,Health Care,Medical/Dental Instruments
KIM,Kimco Realty Corporation (HC) Common Stock,$18.66,0.15,0.81%,12556397597.00,United States,,3905637,Real Estate,Real Estate Investment Trusts
KIM^L,Kimco Realty Corporation Class L Depositary Shares each of which represents a one-one thousandth fractional interest in a share of 5.125% Class L Cumulative Redeemable Preferred Stock liquidation preference $25000.00 per share,$22.44,-0.01,-0.045%,,United States,,7160,,
KIM^M,Kimco Realty Corporation Class M Depositary Shares each of which represents a one-one thousandth fractional interest in a share of 5.25% Class M Cumulative Redeemable Preferred Stock liquidation preference $25000.00 per share,$22.73,0.00,0.00%,,United States,,51879,,
KIM^N,Kimco Realty Corporation Depositary Shares each representing 1/1000th interest in a share of 7.25% Class N Cumulative Convertible Perpetual Preferred Stock,$55.68,0.03,0.054%,,United States,,5336,,
KIND,Nextdoor Holdings Inc. Class A Common Stock,$2.11,0.03,1.442%,830561186.00,United States,,624955,Technology,Computer Software: Programming Data Processing
KINS,Kingstone Companies Inc. Common Stock,$4.43,0.10,2.309%,48764660.00,United States,,12564,Finance,Property-Casualty Insurers
KIO,KKR Income Opportunities Fund Common Shares,$13.47,0.07,0.522%,0.00,,2013,87933,Finance,Investment Managers
KIRK,Kirkland's Inc. COMMONSTOCK,$2.26,-0.01,-0.441%,29212810.00,United States,2002,124349,Consumer Discretionary,Other Specialty Stores
KITT,Nauticus Robotics Inc. Common stock,$0.2605,-0.0073,-2.726%,13034332.00,United States,2021,3928242,Industrials,Industrial Machinery/Components
KITTW,Nauticus Robotics Inc. Warrant,$0.0287,-0.0009,-3.041%,1436028.00,United States,2021,6091,Industrials,Industrial Machinery/Components
K,Kellanova Common Stock,$57.48,0.03,0.052%,19582186672.00,United States,,3161307,Consumer Staples,Packaged Foods
KKR,KKR & Co. Inc. Common Stock,$101.65,0.72,0.713%,89961131915.00,United States,,2078333,Finance,Investment Managers
KKRS,KKR Group Finance Co. IX LLC 4.625% Subordinated Notes due 2061,$19.60,0.02,0.102%,17346170050.00,United States,2021,13991,,
KLAC,KLA Corporation Common Stock,$690.82,7.98,1.169%,93422110784.00,United States,1980,518283,Technology,Electronic Components
KLG,WK Kellogg Co Common Stock,$20.84,0.71,3.527%,1788438388.00,United States,2023,1015472,Consumer Staples,Packaged Foods
KLIC,Kulicke and Soffa Industries Inc. Common Stock,$48.64,0.46,0.955%,2740431444.00,Singapore,,253352,Technology,Semiconductors
KLTR,Kaltura Inc. Common Stock,$1.38,0.03,2.222%,197696215.00,United States,2021,70917,Technology,EDP Services
KLXE,KLX Energy Services Holdings Inc. Common Stock,$7.78,0.17,2.234%,130099634.00,United States,,232603,Energy,Oilfield Services/Equipment
KMB,Kimberly-Clark Corporation Common Stock,$126.05,-0.26,-0.206%,42464127108.00,United States,,1343666,Consumer Discretionary,Containers/Packaging
KMDA,Kamada Ltd. Ordinary Shares,$5.42,0.04,0.743%,243032800.00,Israel,2013,8734,Health Care,Biotechnology: Pharmaceutical Preparations
KMI,Kinder Morgan Inc. Common Stock,$18.36,-0.10,-0.542%,40747632649.00,United States,2011,11639741,Utilities,Natural Gas Distribution
KMPB,Kemper Corporation 5.875% Fixed-Rate Reset Junior Subordinated Debentures due 2062,$23.01,-0.11,-0.476%,1480088176.00,United States,2022,4059,Finance,Property-Casualty Insurers
KMPR,Kemper Corporation,$57.55,-0.61,-1.049%,3701828532.00,United States,,179499,Finance,Property-Casualty Insurers
KMT,Kennametal Inc. Common Stock,$24.34,0.17,0.703%,1929426494.00,United States,,325186,Industrials,Industrial Machinery/Components
KMX,CarMax Inc,$82.87,1.38,1.693%,13086930590.00,United States,,1758966,Consumer Discretionary,Retail-Auto Dealers and Gas Stations
KNDI,Kandi Technologies Group Inc Common Stock,$2.05,0.00,0.00%,179084380.00,China,,98000,Consumer Discretionary,Auto Manufacturing
KNF,Knife Riv Holding Co. Common Stock,$80.85,0.08,0.099%,4574364125.00,United States,2023,247989,,
KN,Knowles Corporation Common Stock,$16.04,0.12,0.754%,1437663035.00,United States,2014,332210,Consumer Staples,Consumer Electronics/Appliances
KNOP,KNOT Offshore Partners LP Common Units representing Limited Partner Interests,$5.26,0.06,1.154%,179103000.00,United Kingdom,2013,41371,Consumer Discretionary,Marine Transportation
KNSA,Kiniksa Pharmaceuticals Ltd. Class A Common Stock,$17.68,-0.22,-1.229%,1248473589.00,United States,2018,312201,Health Care,Biotechnology: Pharmaceutical Preparations
KNSL,Kinsale Capital Group Inc. Common Stock,$459.11,10.97,2.448%,10646345405.00,United States,,162477,Finance,Property-Casualty Insurers
KNTK,Kinetik Holdings Inc. Class A Common Stock,$39.15,-0.23,-0.584%,5919720929.00,United States,2022,479273,Utilities,Natural Gas Distribution
KNW,Know Labs Inc. Common Stock,$0.64,0.0002,0.031%,52061775.00,,2022,46893,Industrials,Industrial Machinery/Components
KNX,Knight-Swift Transportation Holdings Inc.,$53.14,-0.03,-0.056%,8575148660.00,United States,2017,1053793,Industrials,Trucking Freight/Courier Services
KO,Coca-Cola Company (The) Common Stock,$59.27,-0.24,-0.403%,255599277077.00,United States,,10284535,Consumer Staples,Beverages (Production/Distribution)
KODK,Eastman Kodak Company Common New,$5.28,0.17,3.327%,421872000.00,United States,,1081746,Consumer Discretionary,Business Services
KOD,Kodiak Sciences Inc Common Stock,$4.29,0.17,4.126%,225261903.00,United States,2018,872676,Health Care,Biotechnology: Biological Products (No Diagnostic Substances)
KOF,Coca Cola Femsa S.A.B. de C.V.  American Depositary Shares each representing 10 Units (each Unit consists of 3 Series B Shares and 5 Series L Shares),$95.80,0.31,0.325%,20125973051.00,Mexico,1993,60659,Consumer Staples,Beverages (Production/Distribution)
KOP,Koppers Holdings Inc. Common Stock,$55.61,-0.45,-0.803%,1169366524.00,United States,2006,145600,Basic Materials,Forest Products
KOPN,Kopin Corporation Common Stock,$1.65,0.01,0.61%,195406205.00,United States,1992,498445,Technology,Industrial Machinery/Components
KORE,KORE Group Holdings Inc. Common Stock,$0.67,-0.04,-5.634%,58096090.00,United States,,25939,Consumer Discretionary,Telecommunications Equipment
KOS,Kosmos Energy Ltd. Common Shares (DE),$5.91,0.04,0.681%,2786580029.00,Bermuda,2011,15131061,Energy,Oil & Gas Production
KOSS,Koss Corporation Common Stock,$2.521,0.031,1.245%,23331338.00,United States,,9172,Consumer Staples,Consumer Electronics/Appliances
KPLT,Katapult Holdings Inc. Common Stock,$10.35,0.17,1.67%,42074561.00,United States,2019,2075,Consumer Discretionary,Diversified Commercial Services
KPLTW,Katapult Holdings Inc. Warrant,$0.0155,-0.0002,-1.274%,63010.00,United States,2019,62423,Consumer Discretionary,Diversified Commercial Services
KPRX,Kiora Pharmaceuticals Inc.  Common Stock,$0.5924,-0.0056,-0.936%,15554171.00,United States,,155452,Health Care,Biotechnology: In Vitro & In Vivo Diagnostic Substances
KPTI,Karyopharm Therapeutics Inc. Common Stock,$1.35,-0.01,-0.735%,155340562.00,United States,2013,808885,Miscellaneous,Diversified Commercial Services
KRC,Kilroy Realty Corporation Common Stock,$34.94,0.80,2.343%,4099384765.00,United States,1997,564227,Real Estate,Real Estate Investment Trusts
KREF^A,KKR Real Estate Finance Trust Inc. 6.50% Series A Cumulative Redeemable Preferred Stock,$18.6499,0.2899,1.579%,,United States,,21041,,
KREF,KKR Real Estate Finance Trust Inc. Common Stock,$9.76,0.00,0.00%,676503274.00,United States,2017,356535,Real Estate,Real Estate Investment Trusts
KRG,Kite Realty Group Trust Common Stock,$20.70,0.36,1.77%,4542582480.00,United States,2004,1294231,Real Estate,Real Estate Investment Trusts
KRKR,36Kr Holdings Inc. American Depositary Shares,$0.373,0.0079,2.164%,14539070.00,China,2019,30951,Consumer Discretionary,Business Services
KR,Kroger Company (The) Common Stock,$55.37,-1.94,-3.385%,39959855922.00,United States,,7124238,Consumer Staples,Food Chains
KRMD,KORU Medical Systems Inc. Common Stock (DE),$2.465,-0.025,-1.004%,112676383.00,United States,,53820,Health Care,Medical/Dental Instruments
KRNL,Kernel Group Holdings Inc. Class A Ordinary Shares,$10.8299,0.0399,0.37%,0.00,United States,2021,483,Finance,Blank Checks
KRNT,Kornit Digital Ltd. Ordinary Shares,$16.64,0.01,0.06%,794054693.00,Israel,2015,219243,Industrials,Industrial Machinery/Components
KRNY,Kearny Financial Corp Common Stock,$6.09,-0.07,-1.136%,392421300.00,United States,2005,451308,Finance,Savings Institutions
KRO,Kronos Worldwide Inc Common Stock,$12.23,0.12,0.991%,1406780406.00,United States,,245284,Industrials,Major Chemicals
KRON,Kronos Bio Inc. Common Stock,$1.20,-0.03,-2.439%,72114016.00,United States,2020,207284,Health Care, Medicinal Chemicals and Botanical Products 
KROS,Keros Therapeutics Inc. Common Stock,$63.19,0.53,0.846%,2273742263.00,United States,2020,218028,Health Care,Biotechnology: Pharmaceutical Preparations
KRP,Kimbell Royalty Partners Common Units Representing Limited Partner Interests,$16.17,0.03,0.186%,1531278836.00,United States,2017,225275,Energy,Oil & Gas Production
KRRO,Korro Bio Inc. Common Stock,$73.44,5.81,8.591%,589131714.00,United States,2019,20911,Health Care,Biotechnology: Pharmaceutical Preparations
KRT,Karat Packaging Inc. Common Stock,$28.73,-0.14,-0.485%,573796422.00,United States,2021,28142,Industrials,Plastic Products
KRUS,Kura Sushi USA Inc. Class A Common Stock,$114.51,4.46,4.053%,1286028946.00,United States,2019,212597,Consumer Discretionary,Restaurants
KRYS,Krystal Biotech Inc. Common Stock,$180.42,0.40,0.222%,5104553779.00,United States,2017,336544,Health Care,Biotechnology: Biological Products (No Diagnostic Substances)
KSCP,Knightscope Inc. Class A Common Stock,$0.6055,0.0507,9.138%,62165523.00,United States,2022,1974881,Telecommunications,Telecommunications Equipment
KSM,DWS Strategic Municipal Income Trust,$9.57,0.03,0.314%,0.00,United States,1989,23822,Finance,Trusts Except Educational Religious and Charitable
KSPI,Joint Stock Company Kaspi.kz American Depository Shares,$123.50,-9.26,-6.975%,23382682928.00,Kazakhstan,2024,762375,,
KSS,Kohl's Corporation Common Stock,$24.98,-0.52,-2.039%,2770451289.00,United States,1992,6656704,Consumer Discretionary,Department/Specialty Retail Stores
KTB,Kontoor Brands Inc. Common Stock ,$56.21,-0.17,-0.302%,3134248915.00,United States,2019,323493,Consumer Discretionary,Apparel
KTCC,Key Tronic Corporation Common Stock,$4.59,-0.09,-1.923%,49396988.00,United States,1983,12519,Technology,Electrical Products
KTF,DWS Municipal Income Trust,$9.55,-0.01,-0.105%,377233958.00,United States,1988,64025,Finance,Finance Companies
KTH,Structures Products Cp 8% CorTS Issued by Peco Energy Cap Tr II Preferred Stock,$29.00,0.08,0.277%,0.00,United States,,1205,Finance,Investment Managers
KT,KT Corporation Common Stock,$13.54,0.12,0.894%,6933635720.00,South Korea,,860029,Telecommunications,Telecommunications Equipment
KTN,Structured Products Corp 8.205% CorTS 8.205% Corporate Backed Trust Securities (CorTS),$26.836,0.116,0.434%,0.00,United States,,170,Finance,Finance: Consumer Services
KTOS,Kratos Defense & Security Solutions Inc. Common Stock,$18.51,0.71,3.989%,2406252633.00,United States,,1412588,Industrials,Military/Government/Technical
KTRA,Kintara Therapeutics Inc. Common Stock,$0.1345,0.0044,3.382%,5250597.00,United States,,7749447,Health Care,Biotechnology: Pharmaceutical Preparations
KTTA,Pasithea Therapeutics Corp. Common Stock,$8.45,-0.05,-0.588%,8808407.00,United States,2021,3061,Health Care,Biotechnology: Pharmaceutical Preparations
KTTAW,Pasithea Therapeutics Corp. Warrant,$0.0123,0.00,0.00%,12822.00,United States,2021,30,Health Care,Biotechnology: Pharmaceutical Preparations
KUKE,Kuke Music Holding Limited American Depositary Shares each representing one Ordinary Share,$2.15,0.05,2.381%,46839094.00,,2021,23433,Real Estate,Other Consumer Services
KULR,KULR Technology Group Inc. Common Stock,$0.7117,0.1262,21.554%,91015522.00,United States,,25028085,Technology,Electrical Products
KURA,Kura Oncology Inc. Common Stock,$20.42,0.06,0.295%,1554716784.00,United States,,304440,Health Care,Biotechnology: Biological Products (No Diagnostic Substances)
KVAC,Keen Vision Acquisition Corporation Ordinary Shares,$10.50,0.0399,0.381%,0.00,United States,2023,1638,,
KVACU,Keen Vision Acquisition Corporation Units,$10.60,0.01,0.094%,0.00,United States,2023,3056,,
KVACW,Keen Vision Acquisition Corporation Warrant,$0.0705,0.0078,12.44%,0.00,United States,2023,53300,,
KVHI,KVH Industries Inc. Common Stock,$5.03,-0.03,-0.593%,98819108.00,United States,1996,198212,Technology,Radio And Television Broadcasting And Communications Equipment
KVUE,Kenvue Inc. Common Stock,$20.06,-0.19,-0.938%,38406511931.00,United States,2023,9262860,Consumer Discretionary,Specialty Chemicals
KVYO,Klaviyo Inc. Series A Common Stock,$24.04,-0.14,-0.579%,6280078077.00,United States,2023,637042,,
KWE,KWESST Micro Systems Inc. Common Stock,$0.77,-0.0401,-4.95%,4621923.00,Canada,,189882,Technology,Computer Software: Prepackaged Software
KW,Kennedy-Wilson Holdings Inc. Common Stock,$8.45,0.21,2.549%,1174361548.00,United States,,935879,Finance,Real Estate
KWR,Quaker Houghton Common Stock,$196.50,-0.10,-0.051%,3535384377.00,United States,,61153,Industrials,Major Chemicals
KXIN,Kaixin Auto Holdings Ordinary Shares,$0.184,0.0065,3.662%,4871225.00,China,2017,371993,Consumer Discretionary,Retail-Auto Dealers and Gas Stations
KYMR,Kymera Therapeutics Inc. Common Stock,$36.37,-0.03,-0.082%,2222631729.00,United States,2020,296257,Health Care, Medicinal Chemicals and Botanical Products 
KYN,Kayne Anderson Energy Infrastructure Fund Inc.,$9.67,-0.05,-0.514%,1316391895.00,United States,2004,506515,Finance,Finance/Investors Services
KYTX,Kyverna Therapeutics Inc. Common Stock,$23.28,1.06,4.77%,1003722880.00,United States,2024,341030,,
KZIA,Kazia Therapeutics Limited American Depositary Shares,$0.405,0.0412,11.325%,9235179.00,Australia,,767596,Health Care,Biotechnology: Pharmaceutical Preparations
KZR,Kezar Life Sciences Inc. Common Stock,$0.807,0.0095,1.191%,58750697.00,United States,2018,622075,Health Care,Biotechnology: Pharmaceutical Preparations
LAAC,Lithium Americas (Argentina) Corp. Common Shares,$5.28,0.03,0.571%,844367040.00,Canada,2023,765239,,
LABP,Landos Biopharma Inc. Common Stock,$21.50,-0.11,-0.509%,67009674.00,United States,2021,34515,Health Care, Medicinal Chemicals and Botanical Products 
LAB,Standard BioTools Inc. Common Stock,$2.88,0.14,5.109%,835539638.00,United States,2011,2659603,Industrials,Biotechnology: Laboratory Analytical Instruments
LAC,Lithium Americas Corp. Common Shares,$6.68,-0.14,-2.053%,1074144000.00,Canada,2023,2371449,Basic Materials,Metal Mining
LAD,Lithia Motors Inc. Common Stock,$279.13,2.13,0.769%,7684710166.00,United States,,212080,Consumer Discretionary,Retail-Auto Dealers and Gas Stations
LADR,Ladder Capital Corp Class A Common Stock,$10.82,-0.04,-0.368%,1369998331.00,United States,2014,290094,Real Estate,Real Estate Investment Trusts
LAES,SEALSQ Corp Ordinary Shares,$1.33,0.00,0.00%,20544253.00,Switzerland,,363687,Technology,Semiconductors
LAKE,Lakeland Industries Inc. Common Stock,$18.17,-0.45,-2.417%,133817635.00,United States,1986,15219,Health Care,Industrial Specialties
LAMR,Lamar Advertising Company Class A Common Stock,$115.29,0.26,0.226%,11767148212.00,United States,1996,248655,Real Estate,Real Estate Investment Trusts
LANC,Lancaster Colony Corporation Common Stock,$202.83,-1.34,-0.656%,5582084430.00,United States,,80857,Consumer Staples,Packaged Foods
LAND,Gladstone Land Corporation Common Stock,$12.97,-0.03,-0.231%,464824593.00,United States,1993,212918,Real Estate,Real Estate Investment Trusts
LANDM,Gladstone Land Corporation 5.00% Series D Cumulative Term Preferred Stock,$24.1333,-0.0567,-0.234%,864899872.00,United States,,1704,Real Estate,Real Estate Investment Trusts
LANDO,Gladstone Land Corporation 6.00% Series B Cumulative Redeemable Preferred Stock,$20.32,-0.33,-1.598%,728237141.00,United States,,6304,Real Estate,Real Estate Investment Trusts
LANDP,Gladstone Land Corporation 6.00% Series C Cumulative Redeemable Preferred Stock,$20.34,-0.01,-0.049%,728953910.00,United States,,24108,Real Estate,Real Estate Investment Trusts
LANV,Lanvin Group Holdings Limited Ordinary Shares,$1.54,0.14,10.00%,201695448.00,Cayman Islands,1996,25611,Finance,Blank Checks
LARK,Landmark Bancorp Inc. Common Stock,$19.05,0.05,0.263%,104181916.00,United States,,1657,Finance,Major Banks
LASE,Laser Photonics Corporation Common Stock,$1.43,0.02,1.418%,13232389.00,United States,2022,24756,Industrials,Industrial Machinery/Components
LASR,nLIGHT Inc. Common Stock,$12.34,-0.11,-0.884%,583551430.00,United States,2018,167660,Technology,Semiconductors
LATG,Chenghe Acquisition I Co. Class A Ordinary Shares,$11.25,-0.01,-0.089%,182812500.00,Mexico,2022,300,Finance,Blank Checks
LAUR,Laureate Education Inc. Common Stock,$14.79,-0.04,-0.27%,2330751752.00,United States,2017,670548,Real Estate,Other Consumer Services
LAW,CS Disco Inc. Common Stock,$8.39,0.00,0.00%,512304878.00,United States,2021,178330,Technology,Computer Software: Prepackaged Software
LAZ,Lazard Inc. Common Stock,$41.23,0.34,0.831%,4649345932.00,Bermuda,2005,384443,Finance,Investment Managers
